title,salary,requirements,company,city,description,link,source,match_score,match_reason,recommendation,recommendation_reason,greeting
Python/AI实习生,400-500元/天,全职，要求，本科,华为,上海,工作地点：上海-青浦区-金泽,https://www.zhipin.com/job_detail/6b756e2d52e20aa80nB609m8GVFS.html,boss,80,Python/AI技能与岗位核心要求高度匹配（85分），本科背景符合硬性条件，薪资范围在岗位预算内（90分）。,建议投递,技能与学历完全匹配，薪资接受度高，华为实习经历对职业发展有显著加成。,您好，我是计算机专业本科生，熟悉Python及TensorFlow框架，有AI项目实战经验，对华为技术生态充满热情，期待实习机会！
Python软件工程师,15-25K,全职，要求1-3年，本科,杭州某大型互联网电商与云计算上市公司,上海,工作地点：上海--,https://www.zhipin.com/job_detail/6be6994c0fe568520nB50tS-F1BU.html,boss,80,您的 Python 技能与岗位高度匹配（85分），3年经验符合1-3年要求，薪资期望在15-25K范围内。,建议投递,技能匹配度高，薪资在期望范围内，建议投递。,您好，我有3年Python后端开发经验，熟悉微服务架构和Redis，对贵岗位很感兴趣，期待进一步沟通。
Python 开发工程师（AI 工业应用方向）,10-13K,全职，要求1-3年，大专,长弓建辉,上海,工作地点：上海-嘉定区-黄渡,https://www.zhipin.com/job_detail/cef891cd6ab948fe0nBy2Nu1EFZW.html,boss,80,Python开发技能与AI工业应用方向高度匹配（85分），1-3年经验要求与候选人背景基本吻合，薪资期望在岗位范围内。,建议投递,核心技能匹配度高，薪资符合预期，工业AI领域经验可补充提升竞争力。,您好，我有2年Python开发经验，熟悉TensorFlow和工业数据建模，对AI落地场景有实践积累，期待参与贵司技术项目。
python实习生,4-6K,全职，要求经验不限，本科,科企岛,上海,工作地点：上海-松江区-松江大学城,https://www.zhipin.com/job_detail/7071661550c938951X1_3tm8FFZV.html,boss,80,Python基础技能与实习生岗位要求匹配（85分），本科背景符合要求，薪资期望在岗位范围内（90分）。,建议投递,技能与经验满足实习生门槛，薪资匹配度高，适合积累行业经验。,您好，我是Python初学者，熟悉基础语法和数据分析库，对科企岛的实习机会很感兴趣，期待学习成长！
python开发（高薪急招！！！）,11-22K·13薪,全职，要求3-5年，本科,软通动力,上海,工作地点：上海-浦东新区-金桥,https://www.zhipin.com/job_detail/2694571029319bb91XJ63Nu4EldW.html,boss,80,您的Python开发经验与岗位技术栈高度匹配（85分），3-5年工作经验符合硬性要求，薪资期望在岗位范围内（90分）。,建议投递,技能匹配度高且薪资期望合理，软通动力作为大厂能提供良好职业发展平台。,您好，我有3年Python后端开发经验，熟悉Django/Flask框架及MySQL优化，曾主导过高并发系统重构项目，期待加入软通动力团队。
Python开发（线上面试）,10-15K,全职，要求3-5年，大专,法本信息,上海,工作地点：上海-浦东新区-临港,https://www.zhipin.com/job_detail/4f67ef576e64f7fe0nB92Nm-EVVT.html,boss,80,Python开发技能与岗位要求匹配度较高，3-5年经验符合，薪资期望在范围内。,建议投递,技能和经验匹配，薪资合理，发展前景良好。,您好，我有3年Python后端开发经验，熟悉Django框架和数据库优化，期待加入法本信息团队。
金融python开发工程师,7-10K,全职，要求在校/应届，本科,孚厘科技,上海,工作地点：上海-徐汇区-徐汇滨江,https://www.zhipin.com/job_detail/82f56b19050232800nB82925EFVQ.html,boss,74,岗位明确要求在校/应届生，薪资范围7-10K符合应届生预期，但简历内容缺失导致技能匹配度无法精准评估。,建议投递,岗位门槛与应届生身份高度契合，薪资合理，且金融Python方向发展前景良好。,您好，我是应届生，对金融Python开发方向非常感兴趣，希望能有机会加入贵团队，期待您的回复。
python,12-24K·14薪,全职，要求经验不限，本科,上海万宝盛华信息科技,上海,工作地点：上海-浦东新区-金桥,https://www.zhipin.com/job_detail/071509bbdf01fdf60nB-0966FlFW.html,boss,72,Python技能与岗位基础要求匹配（70分），但简历信息缺失导致经验评估受限；薪资范围符合岗位预算，职业发展路径清晰。,可以考虑,技能与薪资匹配度尚可，但缺乏具体项目经验支撑，建议补充技术细节后投递。,您好，我对Python开发岗位很感兴趣，具备扎实的编程基础和快速学习能力，期待能有机会参与贵公司的技术项目。
27实习-Python开发,350-600元/天,全职，要求，本科,上海从鲸信息技术,上海,工作地点：上海-长宁区-中山公园,https://www.zhipin.com/job_detail/c1f76938322a460f0nVy0tS7FVNW.html,boss,72,Python开发技能与岗位需求匹配度较高（75分），但实习经验可能不足（60分），薪资期望在岗位范围内（85分）。,建议投递,技能匹配度良好且薪资符合预期，实习岗位对经验要求相对灵活，建议尝试申请。,您好，我有Python开发基础并熟悉Web框架，对贵司实习岗位很感兴趣，期待能参与实际项目并快速成长。
Python实习生,150-200元/天,全职，要求，大专,彗零信息,上海,工作地点：上海-浦东新区-金桥,https://www.zhipin.com/job_detail/a92dfcafa1176a760nd-3tS0EFc~.html,boss,60,简历信息缺失导致技能匹配度较低，但岗位薪资范围明确且符合实习生标准，发展前景中等。,可以考虑,因简历内容不完整难以全面评估，但薪资匹配且实习岗位对经验要求较低，可作为备选。,您好，我对Python开发充满热情，具备基础编程能力，期待在彗零信息实习中贡献并成长。
Python 开发实习生,300-600元/天,全职，要求，本科,光轮智能,上海,工作地点：上海-嘉定区-安亭,https://www.zhipin.com/job_detail/92dae660340011211HB-2tW7ElFZ.html,boss,55,简历信息缺失导致技能与经验匹配度较低，但薪资范围符合实习生标准，岗位提供成长机会。,可以考虑,虽缺乏具体技能证明，但薪资合理且实习岗位适合积累经验，建议补充简历后申请。,您好，我对Python开发充满热情，具备扎实的编程基础和快速学习能力，期待在光轮智能的实习机会中贡献自己的力量。
python,40-70K·16薪,全职，要求经验不限，本科,某大型基金公司,上海,工作地点：上海--,https://www.zhipin.com/job_detail/a3c386d15650f6390nB_3d20E1ZU.html,boss,30,简历信息缺失导致技能与经验无法评估，薪资期望未明确但岗位范围较宽泛，金融行业Python岗位发展前景良好。,不推荐,简历内容空白无法验证匹配度，建议补充完整经历后再申请。,您好，我对贵司Python开发岗位感兴趣，但简历信息待完善，期待沟通具体需求后进一步交流。
Python（大厂 六险一金）,15-30K,全职，要求经验不限，学历不限,深圳某大型ICT基础设施与智能终端公司,上海,工作地点：上海--,https://www.zhipin.com/job_detail/cdcbf2cb465a640b0nB_0929FVFS.html,boss,0,"AI 评分失败: Error code: 400 - {'error': {'message': 'engine is not available temporarily', 'type': 'failed_precondition_error', 'code': '9'}}",不推荐,AI 分析失败，无法给出推荐,您好，我对贵公司的Python（大厂 六险一金）很感兴趣，希望能进一步沟通。
Python开发工程师,10-15K·15薪,全职，要求1-3年，本科,上海念觉私募,上海,工作地点：上海-浦东新区-陆家嘴,https://www.zhipin.com/job_detail/3a346852bc5718541Xd72925EVpY.html,boss,0,简历内容为空，无法提取核心技能、工作年限及主要成就，导致无法评估与岗位要求的匹配度。,不推荐,由于简历信息缺失，无法判断候选人是否符合岗位硬性要求，建议补充完整简历后再进行评估。,您好，我对贵司Python开发岗位很感兴趣，但当前简历信息不完整，补充后希望能与您进一步沟通。
python工程师,10-15K,全职，要求1-3年，大专,上海锦途广告制作,上海,工作地点：上海-松江区-九亭,https://www.zhipin.com/job_detail/7fe319a8ebaff9200nB92di_FlRS.html,boss,0,未提供简历内容，无法评估技能与经验匹配度。,不推荐,由于简历内容为空，无法进行有效匹配分析，建议补充完整简历后再进行评估。,您好，我对贵司Python工程师岗位很感兴趣，但简历信息待补充，期待与您进一步沟通。
