title,salary,requirements,company,city,description,link,source,match_score,match_reason,recommendation,recommendation_reason,greeting
ai训练师实习生,2-3K,全职，要求经验不限，大专,小鹏汽车,广州,工作地点：广州-天河区-车陂,https://www.zhipin.com/job_detail/e5e804750a7eb88f03Zz2dS6FlNX.html,boss,90,候选人持有‘人工智能训练师三级证书’，且项目经验涉及大模型微调、计算机视觉及机器人巡检，与AI训练师岗位核心需求高度契合。,强烈推荐,技能与项目经验精准匹配岗位，且小鹏汽车提供优秀的行业实践平台，建议优先投递。,您好，我持有AI训练师三级证书，有计算机视觉与大模型微调项目经验，非常契合贵司AI训练师实习岗位，期待加入小鹏汽车。
ai短视频训练师,7-12K,全职，要求经验不限，学历不限,小方家商贸有限公司,广州,工作地点：广州-白云区-石井,https://www.zhipin.com/job_detail/43d50ab395f1a97e0nBy3tS1FVRT.html,boss,88,候选人持有AI训练师证书，具备大模型微调、计算机视觉及Python开发能力，技术栈与岗位高度契合。项目经验涵盖智能巡检与视觉检测，远超基础训练师要求，属于降维打击。,强烈推荐,候选人技术背景扎实，拥有相关证书及大模型落地经验，完全胜任且具备技术优化能力，薪资预期合理，建议优先沟通。,您好，我持有AI训练师证书，精通大模型微调与计算机视觉，有国赛一等奖经验，希望能用技术赋能贵司短视频业务。
Ai大模型开发训练师,10-15K,全职，要求1-3年，学历不限,中创医药生物,广州,工作地点：广州-白云区-嘉禾,https://www.zhipin.com/job_detail/22d668c13fbed9c803Fz2ti5EVdX.html,boss,88,您的简历中明确包含大模型部署与微调、计算机视觉等核心技能，与岗位需求高度契合。项目经验中涉及机器人智能巡检系统，直接关联大模型应用，且拥有国赛一等奖，技术实力突出。,强烈推荐,技能匹配度极高，拥有大模型实战经验及竞赛奖项，完全符合岗位核心要求，建议优先投递。,您好，我对贵司AI大模型开发训练师岗位非常感兴趣。我有大模型部署微调及计算机视觉实战经验，曾获全国人工智能大赛一等奖，期待能与您进一步沟通。
数据标注/AI训练师,4-8K,全职，要求经验不限，中专/中技,艾泽数云,广州,工作地点：广州-天河区-天河北,https://www.zhipin.com/job_detail/692e54f8e210736703x_2dW7GFtR.html,boss,87,候选人具备Python、OpenCV及大模型微调等核心AI技能，远超岗位基础要求。拥有多个AI相关项目经验及竞赛获奖，与AI训练师职责高度契合。薪资范围合理，且候选人学历符合岗位门槛。,强烈推荐,候选人技能栈（Python、CV、大模型）远超数据标注/AI训练师岗位需求，属于降维打击，入职后能快速上手并具备成长潜力。,您好，我有Python及OpenCV开发经验，熟悉YOLO模型训练与大模型微调，曾获AI大赛一等奖，对贵司AI训练师岗位非常感兴趣，期待沟通。
AI训练师,5-8K,全职，要求1-3年，大专,千川传媒,广州,工作地点：广州-白云区-嘉禾,https://www.zhipin.com/job_detail/1ee810de6b5238db0nF63Ni9EFVZ.html,boss,87,您持有‘人工智能训练师三级证书’，且项目经验涉及大模型部署与微调，与AI训练师岗位要求高度契合。,强烈推荐,技能与证书完全对口，项目经验扎实，薪资预期在岗位范围内，具备极高的匹配度。,您好，我持有‘人工智能训练师三级证书’，有千问大模型微调及CV项目经验，与贵司AI训练师岗位高度匹配，期待沟通。
ai人工智能开发工程师,6-7K,全职，要求经验不限，本科,广州市信至达科技,广州,工作地点：广州-黄埔区-大沙,https://www.zhipin.com/job_detail/4c53e8edf01582ca0nRz2NW5FFRR.html,boss,86,候选人技能栈高度匹配，具备大模型微调、计算机视觉及Python开发能力，且拥有国赛一等奖及多个落地项目经验。虽然学历为大专略低于本科要求，但技术实力突出，项目经历远超经验不限的门槛。,建议投递,技术能力与岗位需求高度契合，竞赛获奖和项目经验是显著加分项，建议重点突出技术优势以弥补学历差距。,您好，我对AI开发岗位很感兴趣。我有大模型微调与CV落地经验，获过人工智能大赛省一等奖，GitHub有完整项目代码，期待与您沟通。
ai训练师,100-150元/时,全职，要求经验不限，学历不限,丰清网络,广州,工作地点：广州-天河区-天河北,https://www.zhipin.com/job_detail/5c59d55d42da0caa031z2NW7EVJR.html,boss,85,候选人持有‘人工智能训练师三级证书’，且具备大模型微调、部署及计算机视觉项目经验，技能与岗位高度契合。,强烈推荐,技能与证书高度匹配，项目经验扎实，虽学历为大专但技术栈对口，建议优先投递。,您好，我持有AI训练师证书，熟悉大模型微调与CV项目，有丰富落地经验，期待能加入贵司团队。
数据标注/AI训练师,6-8K,全职，要求经验不限，本科,阿里巴巴智能信息事业群,广州,工作地点：广州-天河区-高唐,https://www.zhipin.com/job_detail/ec563b0563a2ddd10nB82N-1GFBR.html,boss,85,候选人持有‘人工智能训练师三级证书’，且项目经验涉及大模型微调、计算机视觉及数据标注相关开发，与岗位核心技能高度匹配。,建议投递,虽然学历为大专略低于本科要求，但技能匹配度极高且有相关证书和项目落地经验，建议尝试申请。,您好，我持有AI训练师三级证书，熟悉大模型微调与CV数据处理，有机器人巡检等项目落地经验，期待能加入阿里智能信息事业群。
AI客服训练师（五险一金+年终奖）,10-15K·13薪,全职，要求经验不限，本科,灏仟亿科技集团,广州,工作地点：广州-白云区-石井,https://www.zhipin.com/job_detail/db233088ef6815470nBz2N-8FlZQ.html,boss,85,候选人具备大模型部署与微调、计算机视觉等核心AI技能，且有千问大模型开发项目经验，与AI客服训练师岗位高度契合。虽然学历为大专，但技术栈全面且获奖丰富，能弥补学历短板。,强烈推荐,候选人拥有实际的大模型应用开发经验，技术能力超出岗位基本要求，且薪资期望在合理范围内，具备极高的培养价值。,您好，我有大模型微调与部署经验，曾基于千问大模型开发智能巡检系统，熟悉AI应用落地，对贵司AI客服训练师岗位非常感兴趣，期待沟通。
AI训练师/工程师（大小周）,15-30K,全职，要求1-3年，大专,即刻文化,广州,工作地点：广州-白云区-黄边,https://www.zhipin.com/job_detail/068f88f5cc9ee58d03xz3Ni0ElVX.html,boss,85,您的Python、大模型微调及计算机视觉技能与AI训练师岗位高度匹配（90分），且拥有国赛一等奖及多个AI项目落地经验，经验相关性极强（85分）。,建议投递,技能栈与岗位需求高度契合，项目经验扎实，虽薪资期望未明确但具备较强议价能力，建议积极申请。,您好，我对AI训练师岗位非常感兴趣。我有3年Python及大模型微调经验，曾获全国人工智能大赛一等奖，期待能与您进一步沟通。
AI数字员工训练专员（Agent工作流优化）,4-6K,全职，要求1年以内，本科,鑫昇科技,广州,工作地点：广州-番禺区-市桥,https://www.zhipin.com/job_detail/c6606a1011cf9c150nBz09S-GFpZ.html,boss,85,候选人掌握Python、大模型微调及计算机视觉技能，与AI数字员工训练岗位高度契合。项目经验涵盖模型训练与Agent开发，具备较强的实战能力。,建议投递,技能与项目经验高度匹配岗位需求，薪资期望合理。虽学历为大专（岗位要求本科），但竞赛获奖及项目成果可弥补学历短板，建议尝试。,您好，我有Python及大模型微调经验，曾获全国人工智能大赛一等奖，熟悉Agent工作流优化，期待能加入贵司团队。
AI训练专家,10-15K,全职，要求经验不限，硕士,艺兔科技,广州,工作地点：广州-天河区-棠下,https://www.zhipin.com/job_detail/2999230f94b7bee60nB60tm-E1dW.html,boss,85,您的 Python、大模型部署、计算机视觉技能与 AI 训练专家岗位高度匹配（85分），项目经验涉及机器人巡检、视觉检测等核心场景，经验相关性高（80分）。薪资期望未明确，但岗位 10-15K 范围合理（90分）。AI 训练方向前景广阔，且您有竞赛获奖和项目落地经验，成长空间大（85分）。,建议投递,技能与项目经验高度匹配 AI 训练岗位，虽学历为大专（岗位要求硕士），但实际能力突出，建议积极申请。,您好，我对 AI 训练专家岗位很感兴趣。我有大模型部署、CV 及机器人项目经验，获过人工智能大赛一等奖，期待能与您沟通。
AI训练师,3-4K·13薪,全职，要求在校/应届，本科,广州火羽信息科技,广州,工作地点：广州-天河区-棠下,https://www.zhipin.com/job_detail/9b90f7047245951a0nZ52Nm7FVtR.html,boss,82,候选人拥有AI训练师三级证书及丰富的计算机视觉、大模型微调项目经验，技能高度匹配；但学历为大专，与岗位要求的本科存在差距，且薪资偏低。,可以考虑,技能与项目经验高度契合，但学历未达硬性要求且薪资偏低，建议作为备选尝试。,您好，我持有AI训练师三级证书，有计算机视觉与大模型微调实战经验，曾获省赛一等奖，希望能争取面试机会。
AI人工智能实习生,150-200元/天,全职，要求，本科,米袋软件,广州,工作地点：广州-海珠区-赤岗,https://www.zhipin.com/job_detail/7f7c280dc136974703B739W4GVdQ.html,boss,82,您的 Python、大模型部署及计算机视觉技能与 AI 岗位高度匹配（85分），项目经验丰富且获奖，但学历为大专，与岗位要求的本科存在一定差距。,建议投递,技能与项目经验高度契合，薪资期望合理，虽学历有差距但技术实力强，值得争取。,您好，我有 Python 与大模型部署经验，熟悉 OpenCV 及多项目落地，获国赛一等奖，希望能有机会加入米袋软件。
AI训练师,7-9K,全职，要求1-3年，大专,广州桐生日投咨询,广州,工作地点：广州-天河区-天河北,https://www.zhipin.com/job_detail/a325432580a1854e031-3NW4E1JU.html,boss,82,候选人持有AI训练师三级证书，且项目经验涵盖大模型微调与计算机视觉，技能与岗位高度契合。虽工作年限略低于要求（应届生），但丰富的国赛获奖及落地项目经验足以弥补，且薪资期望在合理区间。,建议投递,技能证书与项目经验高度对口，虽工作年限稍短但潜力巨大，薪资匹配度高。,您好，我是蒋睿，持有AI训练师三级证书，具备大模型微调及YOLO训练实战经验，曾获国赛一等奖，对贵司岗位非常感兴趣，期待沟通。
AI训练师（千川短视频）,20-40K,全职，要求1-3年，大专,精武门,广州,工作地点：广州--,https://www.zhipin.com/job_detail/388713f5644428370nBz3tu7EFRZ.html,boss,82,您持有AI训练师三级证书，且有大模型部署、YOLO训练及计算机视觉项目经验，技能与岗位高度契合。虽然缺乏商业项目经验，但竞赛获奖和项目深度足以弥补，薪资期望在合理区间。,建议投递,具备AI训练师证书及大模型/视觉项目经验，技能栈与岗位高度匹配，建议积极投递。,您好，我持有AI训练师三级证书，有千问大模型部署及CV项目经验，对贵司AI训练师岗位很感兴趣，期待沟通。
AI音乐训练师,140-150元/天,全职，要求，大专,点米立德,广州,工作地点：广州-黄埔区-大沙,https://www.zhipin.com/job_detail/4ecba7caf5ff68920nF63Ny1GVJZ.html,boss,80,您的 Python 和 AI 模型微调技能与岗位高度匹配（85分），虽然过往项目侧重视觉而非音乐，但底层 AI 训练逻辑相通。,建议投递,技能匹配度高，薪资在期望范围内，且具备 AI 训练师所需的模型部署与数据处理能力，建议投递。,您好，我有 AI 模型微调与部署经验，熟悉大模型训练流程，对 AI 音乐训练师岗位很感兴趣，期待进一步沟通。
美术AI训练师,6-11K·13薪,全职，要求在校/应届，本科,钥棠(广州),广州,工作地点：广州-天河区-棠下,https://www.zhipin.com/job_detail/01fb05a11fcc5e2e03d52tm5ElFZ.html,boss,80,候选人持有‘人工智能训练师’证书，且具备大模型微调与计算机视觉项目经验，技能与岗位核心需求高度契合。虽然学历为大专（岗位要求本科），但其丰富的竞赛获奖（省一等奖）和项目实战经验能有效弥补学历短板。,可以考虑,技能高度对口（AI训练师证书+大模型/CV项目），但学历（大专）低于岗位要求（本科），存在简历筛选风险，建议尝试投递。,您好，我持有‘人工智能训练师’证书，具备大模型微调与CV项目经验，曾获省赛一等奖，对美术AI训练岗位非常感兴趣，期待沟通。
数据标注/ai训练师/AI 框架训练师,10-15K,全职，要求1-3年，学历不限,梦意化妆品,广州,工作地点：广州-越秀区-三元里,https://www.zhipin.com/job_detail/a5267e7a7147fa400nV62tm9GFVR.html,boss,80,您的 Python、大模型微调及计算机视觉技能与 AI 训练师岗位高度匹配（85分），项目经验涉及模型训练与部署，具备扎实的技术基础。,建议投递,技能匹配度高，薪资在期望范围内，建议投递。,您好，我有大模型微调与计算机视觉项目经验，熟悉 OpenCV 及模型训练流程，对 AI 训练师岗位很感兴趣，期待进一步沟通。
ai训练师,2500-3000元/周,全职，要求1-3年，大专,臻尚皮具,广州,工作地点：广州-白云区-嘉禾,https://www.zhipin.com/job_detail/07fb5cb6338f80f11H143dS8FFNU.html,boss,80,您持有‘人工智能训练师三级证书’且具备大模型微调与CV项目经验，技能高度匹配；但项目多为在校/比赛性质，全职工作年限略低于1-3年要求。,建议投递,技能与证书完全对口，薪资范围合理，虽工作年限稍短但项目密度高，值得尝试。,您好，我持有AI训练师三级证书，熟悉大模型微调与CV检测，有丰富项目落地经验，对贵司AI应用方向很感兴趣，期待沟通。
认知训练师（广东省中医院）,7-10K,全职，要求1-3年，大专,智精灵科技,广州,工作地点：广州-越秀区-北京路,https://www.zhipin.com/job_detail/7a6cb5ac7f44ba670nBy0t6_E1BQ.html,boss,80,候选人持有‘人工智能训练师’证书，且具备大模型微调、计算机视觉及数据处理项目经验，与认知训练师岗位高度契合。,建议投递,技能匹配度高，拥有相关证书及医疗/数据类项目背景，薪资预期符合岗位范围。,您好，我持有‘人工智能训练师’证书，熟悉大模型微调与计算机视觉，有医疗巡检项目经验，非常契合认知训练师岗位，期待沟通。
通用大模型训练师,120-150元/天,全职，要求，大专,广州吉飞,广州,工作地点：广州-黄埔区-大沙,https://www.zhipin.com/job_detail/52c84787b54bfcb40nBy3NS0F1FR.html,boss,80,您的 Python 及大模型部署微调技能与岗位高度匹配（85分），具备计算机视觉与模型训练实战经验，学历符合大专要求。,建议投递,技能匹配度高，薪资在期望范围内，建议投递。,您好，我有大模型部署与微调实战经验，熟悉千问模型及计算机视觉，对通用大模型训练师岗位很感兴趣，期待进一步沟通。
Ai 训练师（服装电商）,5-10K,全职，要求1-3年，本科,广州鹊咏琪服饰,广州,工作地点：广州-番禺区-石基,https://www.zhipin.com/job_detail/458e5bef3a8946a40nZ909m_E1tV.html,boss,80,候选人持有AI训练师三级证书，具备大模型部署、微调及计算机视觉项目经验，技能与岗位高度匹配。薪资期望符合岗位预算范围，但学历（大专）未达到岗位硬性要求（本科），且行业跨度需适应。,建议投递,技能匹配度高，薪资在期望范围内，建议投递。,您好，我有AI训练师三级证书及大模型部署经验，熟悉计算机视觉与电商场景结合，对贵司岗位很感兴趣，期待进一步沟通。
AI训练师,15-25K,全职，要求1-3年，本科,东莞衍创文化,广州,工作地点：广州-白云区-罗冲围,https://www.zhipin.com/job_detail/56e8f556f0c0a8ee0nZz3NW5FlVT.html,boss,78,候选人持有AI训练师证书且具备大模型微调、CV等核心技能，高度匹配岗位需求；但学历为大专且项目经验多为竞赛/学校项目，与要求的本科及1-3年全职经验存在差距。,可以考虑,技能与证书高度对口，但学历和经验年限未完全达标，建议作为备选尝试沟通。,您好，我持有AI训练师证书，熟悉大模型微调与CV技术，有多项AI项目落地经验，对贵司岗位很感兴趣，期待进一步沟通。
客服机器人训练师【base 厦门】,12-18K,全职，要求3-5年，大专,跑红集团,广州,工作地点：广州-花都区-花山,https://www.zhipin.com/job_detail/5a1e924b150a744a0nB93t66EFVY.html,boss,78,候选人具备大模型部署与微调、计算机视觉等AI核心技能，与客服机器人训练师岗位高度契合。虽然项目经验多为竞赛与校园项目，缺乏3-5年商业落地经验，但技术栈匹配度极高。,建议投递,技能匹配度高，薪资在期望范围内，且具备AI训练相关背景，建议投递。,您好，我有大模型部署与微调经验，熟悉计算机视觉及机器人控制，对客服机器人训练师岗位很感兴趣，期待进一步沟通。
ai训练师（电商）,10-15K,全职，要求1-3年，本科,瞬途体育,广州,工作地点：广州-番禺区-祈福,https://www.zhipin.com/job_detail/89547b00089dd1ba0ndz3d--EVpT.html,boss,78,候选人持有‘人工智能训练师三级证书’，且具备大模型部署、微调及计算机视觉项目经验，与岗位核心技能高度匹配。虽然学历为大专（岗位要求本科），但丰富的实战项目经验可弥补学历短板。,建议投递,技能与证书高度契合岗位需求，项目经验扎实，薪资期望大概率在范围内，建议积极争取面试机会。,您好，我持有‘人工智能训练师三级证书’，熟悉大模型部署与微调，有计算机视觉及电商小程序开发经验，对贵司AI训练师岗位非常感兴趣，期待沟通。
ai训练师,10-15K,全职，要求3-5年，本科,广州肌之密化妆品,广州,工作地点：广州-白云区-黄边,https://www.zhipin.com/job_detail/c64046a98b2ab7190nd52Ni8EVBX.html,boss,76,您持有AI训练师三级证书且有大模型微调、计算机视觉落地项目经验，技能高度匹配；但学历为大专且工作年限可能不足3年，与岗位硬性要求存在差距。,可以考虑,技能与证书高度对口，但学历和年限未完全达标，建议作为备选尝试投递，重点突出项目实战能力。,您好，我持有AI训练师三级证书，有千问大模型微调及计算机视觉落地经验，对贵司AI应用方向很感兴趣，期待沟通。
ai训练师,5-6K,全职，要求1-3年，本科,金点互动,广州,工作地点：广州-天河区-天河公园,https://www.zhipin.com/job_detail/d13367278c57494903Z42Ni-FFpR.html,boss,75,候选人具备人工智能训练师三级证书及多个AI相关项目经验（大模型微调、CV），技能高度匹配（85分）；但学历为大专且工作年限可能不足1年，与岗位本科及1-3年经验要求存在差距（60分）。,可以考虑,技能与证书高度契合岗位核心需求，但学历和工作年限略低于硬性要求，建议作为备选投递，突出项目实战优势。,您好，我持有AI训练师三级证书，有3个AI项目实战经验（大模型微调/CV），虽为大专学历但技术扎实，期待能有机会面试沟通。
AI训练师,12-20K,全职，要求1-3年，本科,广州墨尔智慧科技,广州,工作地点：广州-海珠区-琶洲,https://www.zhipin.com/job_detail/2068db72f086f87803Vy3tu-EFpQ.html,boss,75,候选人掌握大模型部署、微调及计算机视觉技能，与AI训练师岗位高度契合（80分）；但学历为大专且缺乏正式工作经验，与岗位要求的本科及1-3年经验存在差距（60分）。,可以考虑,技术栈对口且有竞赛获奖加持，但学历和工作经验未完全达标，建议作为备选尝试。,您好，我对AI训练师岗位很感兴趣。我有大模型微调、CV项目经验及AI大赛一等奖，虽为应届但技术扎实，期待能有机会面试沟通。
AI客服训练师--周末双休,6-8K,全职，要求1-3年，本科,方欣科技有限公司,广州,工作地点：广州-黄埔区-科学城,https://www.zhipin.com/job_detail/c139f1737aafd5540nB42t-_FVdW.html,boss,75,候选人具备大模型微调、部署及人工智能训练师证书，技能与岗位高度契合；但学历为大专且缺乏 1-3 年全职工作经验，与岗位硬性要求存在一定差距。,建议投递,大模型项目经验与 AI 训练师岗位高度对口，且持有相关证书，但学历和经验年限略低于要求，建议尝试投递。,您好，我对 AI 客服训练师岗位很感兴趣。我有大模型微调部署经验及人工智能训练师证书，曾主导机器人智能巡检项目，希望能有机会沟通。
AI大模型评测/项目管理（策略方向）,8-13K,全职，要求1-3年，本科,广州诚毅软件,广州,工作地点：广州-天河区-龙洞,https://www.zhipin.com/job_detail/6349dfc0c952c4d50nB93NS8FlRR.html,boss,75,候选人具备Python、大模型部署与微调等核心技能，与AI评测岗位高度匹配（85分）。但学历为大专且缺乏企业级项目管理经验，经验相关性稍弱（60分）。,可以考虑,技术栈与AI方向契合度高，但学历和经验年限略低于岗位要求，建议作为备选尝试投递。,您好，我有Python及大模型微调实战经验，曾获人工智能大赛一等奖，对贵司AI评测岗位非常感兴趣，期待进一步沟通。
AI训练师(空间大),10-15K,全职，要求3-5年，本科,Frog,广州,工作地点：广州-白云区-黄石,https://www.zhipin.com/job_detail/499f43c9786cdab303J50tS5FlVW.html,boss,75,您的 Python、大模型微调及计算机视觉技能与 AI 训练师岗位高度匹配（85分），项目经验扎实。但岗位要求本科及3-5年经验，您目前学历为大专且工作年限较短，经验相关性得分略低（70分）。,可以考虑,技能栈非常契合，但学历和工作年限未完全达到硬性要求，建议作为备选尝试投递，突出项目成果以弥补硬性条件差距。,您好，我对贵司 AI 训练师岗位很感兴趣。我有 Python 及大模型微调实战经验，获过人工智能大赛一等奖，希望能有机会与您沟通。
童装AI美工/AI训练师,8-13K,全职，要求3-5年，本科,广州澄荣贸易有限公司,广州,工作地点：广州-白云区-太和,https://www.zhipin.com/job_detail/eb62ea6101a3cf9e0nZz2969ElpZ.html,boss,70,您的AI模型训练、计算机视觉及Python技能与岗位高度匹配（85分），但岗位明确要求3-5年经验，您作为应届生/在校生经验相关性较低（40分）。,可以考虑,技术栈高度契合AI训练师需求，但工作年限未达硬性要求，建议作为备选尝试投递，突出项目实战能力。,您好，我对童装AI美工岗位很感兴趣。我有大模型微调、CV视觉及Python开发经验，曾获AI大赛一等奖，期待能展示我的项目成果。
AI训练师-业务流程自动化-双休,10-15K·13薪,全职，要求3-5年，本科,广州盛为电子,广州,工作地点：广州-白云区-三元里,https://www.zhipin.com/job_detail/158b3f26aaf8be780nB8292_FlpZ.html,boss,70,您的大模型部署、微调及计算机视觉技能与AI训练师岗位高度匹配（80分），但学历（大专）及工作年限（应届/初级）未达岗位硬性要求（本科、3-5年）。,可以考虑,技能栈契合度高，但硬性条件（学历/年限）存在差距，建议作为备选尝试投递。,您好，我对AI训练师岗位很感兴趣。我有大模型微调、部署及CV项目经验，曾获人工智能大赛一等奖，希望能有机会沟通。
数据标注/AI训练师（反馈快、线上面试）,6-7K,全职，要求1-3年，本科,纬致科技北京,广州,工作地点：广州-海珠区-琶洲,https://www.zhipin.com/job_detail/964e702711cc818f0nB-2tS_F1VU.html,boss,70,候选人具备大模型微调、OpenCV等AI技能，远超数据标注岗位要求（85分），但学历为大专且缺乏全职工作经验，与本科及1-3年要求存在差距（60分）。,可以考虑,技能匹配度高，但学历和经验未完全达标，且岗位发展空间有限，建议作为备选。,您好，我有大模型微调及计算机视觉项目经验，熟悉AI全流程，能快速上手数据标注与训练工作，期待进一步沟通。
