title,salary,requirements,company,city,description,link,source,match_score,match_reason,recommendation,recommendation_reason,greeting
Python中初级软件工程师,10-13K,全职，要求3-5年，本科,蓝光软件,广州,工作地点：广州--,https://www.zhipin.com/job_detail/6b9407c26b0049db03N40928E1NV.html,boss,80,您的 Python 技能与岗位高度匹配（85分），且具备大模型部署与计算机视觉等前沿 AI 项目经验，远超普通初级工程师。但学历为大专，与岗位要求的本科存在硬性差距，且工作年限处于 3 年门槛边缘，因此经验相关性评分为 70 分。,建议投递,虽然学历存在短板，但您的 AI 实战能力和 GitHub 开源项目极具竞争力，薪资期望也在合理范围内，建议尝试投递以争取面试机会。,您好，我有 3 年 Python 开发经验，主导过人脸识别与机器人巡检等 AI 项目，熟悉大模型微调，希望能有机会与您沟通。
Python程序开发,8-12K,全职，要求1-3年，大专,广州之音,广州,工作地点：广州-天河区-东圃,https://www.zhipin.com/job_detail/254f3ea3c5d3f96d0nZ83NW0GVpV.html,boss,80,您的 Python 技能与岗位高度匹配（85分），且具备 AI/CV 项目经验加分。学历符合大专要求，项目经验丰富，虽工作年限可能处于 1 年左右，但能力超出预期。,建议投递,技能匹配度高，薪资在期望范围内，建议投递。,您好，我有扎实的 Python 开发经验，熟悉 OpenCV 与大模型部署，曾获人工智能大赛一等奖，对贵司 Python 岗位很感兴趣，期待进一步沟通。
PYTHON 开发工程师,15-30K,全职，要求在校/应届，本科,远思基金,广州,工作地点：广州-番禺区-大学城,https://www.zhipin.com/job_detail/8d3aebe3f5c32efa03Ry2d66EFNX.html,boss,80,您的 Python 技能与岗位高度匹配（85分），具备大模型部署与微调等前沿技术经验。项目经历丰富，涵盖人脸识别、商务系统及机器人巡检，展现了较强的工程落地能力。,建议投递,技能匹配度高，薪资在期望范围内，但学历为大专，需重点突出项目成果与竞赛奖项以弥补学历短板。,您好，我有扎实的 Python 开发及大模型微调经验，曾获人工智能大赛一等奖，GitHub 有完整项目落地，期待能有机会展示技术实力。
Python 全栈技术工程师,8-12K,全职，要求1-3年，大专,广州中恒智能装备,广州,工作地点：广州--,https://www.zhipin.com/job_detail/c002253c614d90e20nd_3tS_FlBQ.html,boss,80,您的Python全栈技能与岗位高度匹配（90分），具备AI与机器人项目经验；但缺乏正式全职工作经验，经验相关性稍弱（65分）。,建议投递,技术栈与岗位高度匹配，且有AI/机器人相关项目背景，虽工作经验稍显不足，但潜力巨大。,您好，我有扎实的Python全栈开发能力，熟悉AI模型部署与机器人控制，曾获人工智能大赛一等奖，期待加入贵司智能装备团队。
Python,2-3K,全职，要求1年以内，大专,广州协方差科技,广州,工作地点：广州-白云区-黄石,https://www.zhipin.com/job_detail/e32bdbf1101ff46403dy3N2-EVFT.html,boss,80,您的 Python 技能与岗位高度匹配（85分），且具备大模型部署、计算机视觉等 AI 相关项目经验，远超普通 Python 开发要求。但项目多为学校/竞赛性质，企业级实战经验稍显不足。,建议投递,技能匹配度高，薪资要求（2-3K）在您的期望范围内，且岗位对经验要求宽松，适合积累第一份工作经验。,您好，我有扎实的 Python 基础及大模型部署、计算机视觉项目经验，曾获人工智能大赛一等奖，对贵司 Python 岗位非常感兴趣，期待沟通。
python实习生,150-200元/天,全职，要求，本科,千幻大数据,广州,工作地点：广州-天河区-体育中心,https://www.zhipin.com/job_detail/08a9ff69fa5c6c9c03B_29m8EFFX.html,boss,80,您的Python及AI技能与岗位高度匹配（85分），项目经验丰富且涉及大模型与计算机视觉（80分），薪资期望在实习范围内（90分）。,建议投递,技能匹配度高，项目经验亮眼，但学历为大专与岗位要求本科存在偏差，建议尝试沟通。,您好，我有扎实的Python及AI落地经验，曾获人工智能大赛一等奖，熟悉大模型部署与CV开发，希望能争取到实习机会。
python开发实习生,3-5K,全职，要求1-3年，大专,青莲网络,广州,工作地点：广州-天河区-五山,https://www.zhipin.com/job_detail/bc07bdf038e73a7603Zz2Nq7FlFQ.html,boss,80,您的 Python 技能与岗位高度匹配（95分），具备大模型部署与微调经验，远超实习生要求；但缺乏 1-3 年全职商业项目经验（70分）。,建议投递,技术栈全面且与岗位高度契合，虽缺乏全职经验但项目成果丰富，具备培养潜力，薪资在实习生范围内。,您好，我有扎实的 Python 开发能力，熟悉大模型部署与 CV 项目落地，对青莲网络的实习岗位非常感兴趣，期待加入团队。
python后端开发工程师,13-25K,全职，要求经验不限，学历不限,衣神科技,广州,工作地点：广州-天河区-时尚天河,https://www.zhipin.com/job_detail/289b774057abd12f1nxy09W7GFNY.html,boss,80,候选人精通Python且具备多个后端项目经验，技能与岗位高度匹配；虽为应届生但项目丰富，经验相关性较强。,建议投递,Python技术栈与岗位需求高度契合，且具备AI相关项目经验，属于复合型人才，值得争取。,您好，我有扎实的Python后端开发经验，熟悉数据库设计与接口开发，并具备大模型部署及计算机视觉项目实战，期待加入贵司。
python,450-500元/时,全职，要求经验不限，学历不限,迈特互联,广州,工作地点：广州-番禺区-大石,https://www.zhipin.com/job_detail/f01cf7e91705f3941HJ80tm5F1NQ.html,boss,80,您的 Python 技能与岗位高度匹配（85分），具备大模型部署与全栈开发能力。薪资极具吸引力（90分），且岗位对经验学历要求宽松，非常适合您。,强烈推荐,技能匹配度高，薪资极具竞争力，且岗位门槛友好，是极佳的职业起步机会。,您好，我是蒋睿，精通 Python 及 AI 大模型应用，获全国人工智能大赛一等奖，有丰富全栈开发经验，期待加入迈特互联。
Python,8-15K,全职，要求3-5年，大专,优浪网络,广州,工作地点：广州-天河区-黄村,https://www.zhipin.com/job_detail/4173479cbc02b5f403B52N26Els~.html,boss,78,您的 Python 技能与岗位高度匹配（85分），具备 AI 与全栈开发能力；但岗位要求 3-5 年经验，您目前主要为项目经验，工作年限略低于预期（60分）。,可以考虑,技术栈契合度高，薪资在期望范围内，但工作年限未完全达标，建议作为备选尝试。,您好，我有扎实的 Python 开发基础，熟悉 AI 模型部署与全栈开发，项目经验丰富，对贵司岗位很感兴趣，期待进一步沟通。
Python  AI开发,150-200元/天,全职，要求，本科,金扬化工,广州,工作地点：广州-白云区-嘉禾,https://www.zhipin.com/job_detail/9cc9a8fb28e1f9110nRy29y4EVJR.html,boss,78,您的 Python 与 AI 技能栈（大模型、CV）与岗位高度匹配（85分），项目经验扎实；但学历为大专，与岗位要求的本科存在硬性差距，且薪资水平较低，综合评分 78 分。,建议投递,技能匹配度高，薪资门槛低，适合积累 AI 落地经验，但需克服学历门槛。,您好，我有扎实的 Python 与 AI 项目经验，熟悉大模型部署及计算机视觉，对化工行业 AI 应用很感兴趣，期待进一步沟通。
python实习生,150-200元/天,全职，要求，本科,致点信息科技,广州,工作地点：广州-黄埔区-鱼珠,https://www.zhipin.com/job_detail/86a6fa353f01597d0nRy39i1FFpV.html,boss,78,候选人精通Python及AI相关技术，项目经验与岗位高度契合（90分），但学历为大专，与岗位要求的本科存在差距（70分）。薪资期望未明确，但实习薪资范围合理（85分）。,建议投递,技术栈与岗位高度匹配，项目经验丰富，虽学历未达本科要求，但技能突出，建议尝试争取面试机会。,您好，我有扎实的Python开发及AI项目经验，熟悉大模型部署与计算机视觉，对贵司Python实习岗位非常感兴趣，期待进一步沟通。
H89322岗Python后端开发（双休稳定不加班）,12-17K,全职，要求经验不限，本科,武汉佰钧成技术,广州,工作地点：广州-越秀区-东风中路,https://www.zhipin.com/job_detail/5aa209e842947eec0nBy3tq8FFZV.html,boss,78,您的 Python 技能与岗位高度匹配（85分），具备多个后端项目经验。但学历为大专（岗位要求本科），且项目多为竞赛/学校性质，企业级经验稍弱。,建议投递,虽然学历未达硬性要求，但岗位注明经验不限且技能高度对口，您的 Python 和 AI 项目经验是加分项，值得尝试。,您好，我有扎实的 Python 后端开发能力，熟悉数据库设计与接口开发，且具备 AI 模型部署经验，对贵司岗位很感兴趣，期待进一步沟通。
Python,10-12K,全职，要求1-3年，本科,凌马高新科技,广州,工作地点：广州-荔湾区-西关,https://www.zhipin.com/job_detail/a7f9a20cb5dff0061XJ429q_EFZR.html,boss,78,您的 Python 技能与岗位高度匹配（85分），具备大模型部署与计算机视觉等加分项。但岗位明确要求本科学历，您为大专学历（70分），且缺乏企业级实战经验，主要依靠竞赛和项目经历支撑。,可以考虑,技能匹配度高且薪资在期望范围内，但学历和经验存在硬性门槛，建议作为备选尝试投递，重点突出竞赛获奖和项目落地能力。,您好，我有扎实的 Python 开发能力，曾获人工智能应用技能大赛一等奖，熟悉大模型部署与 CV 项目，对贵司岗位很感兴趣，期待进一步沟通。
后端开发工程师（Python+Java）,5-6K,全职，要求1-3年，大专,乐阳智能,广州,工作地点：广州-番禺区-南村,https://www.zhipin.com/job_detail/f115fe17188fecf90nB42Nm5GVNW.html,boss,78,候选人精通Python和Java，技能栈与岗位高度匹配（85分），且具备大模型与CV项目经验；但工作年限不足1年，与企业级后端实战经验要求有差距（60分）。,建议投递,技术栈完全对口且具备AI加分项，薪资期望在岗位范围内，虽经验稍浅但潜力巨大，性价比高。,您好，我精通Python/Java后端开发，有计算机视觉与大模型落地项目经验，对乐阳智能岗位很感兴趣，期待沟通。
初级python开发工程师,10-15K,全职，要求1-3年，本科,广州绿慧智能科技,广州,工作地点：广州-南沙区-金洲,https://www.zhipin.com/job_detail/8e201927ef78d05803Fz3dq-GFRZ.html,boss,78,您的 Python 技能与岗位高度匹配（90分），具备大模型部署与计算机视觉项目经验。但学历为大专，与岗位要求的本科存在差距，且缺乏企业级正式工作经验（60分）。,可以考虑,技能匹配度高，但学历和经验略低于硬性要求，建议作为备选尝试投递。,您好，我有扎实的 Python 开发能力，擅长大模型部署与 CV 项目，曾获人工智能大赛一等奖，对贵司岗位很感兴趣，期待进一步沟通。
AI工程师（精通python和Java）,10-15K,全职，要求1-3年，本科,广州秒搭人工智能科技,广州,工作地点：广州-天河区-科学城,https://www.zhipin.com/job_detail/9f6f2c8106b36d290nBy2d-5GVpX.html,boss,78,您的 Python 和 Java 技能与岗位高度匹配（85分），且具备大模型部署、YOLO 训练等 AI 项目经验。但学历为大专，与岗位要求的本科存在差距，且缺乏企业级实战经验，经验相关性得分 70。,可以考虑,技能栈与岗位需求高度吻合，且有竞赛获奖和项目落地经验，但学历未达硬性要求，建议作为备选尝试投递。,您好，我有扎实的 Python/Java 开发能力，主导过人脸识别及大模型巡检项目，获省赛一等奖，对贵司 AI 岗位非常感兴趣，期待沟通。
Python,15-16K,全职，要求1-3年，本科,广东无变科技信息,广州,工作地点：广州-白云区-白云大道,https://www.zhipin.com/job_detail/fe3b259ce8eaf7871XJy0tS0E1pU.html,boss,78,您的 Python 技能与岗位高度匹配（85分），且具备大模型部署与微调等前沿 AI 经验。但学历为大专且缺乏 1-3 年商业项目经验（70分），与岗位硬性要求存在一定差距。,建议投递,虽然学历和经验年限略低于要求，但您的 Python 技术栈和 AI 项目实战能力突出，具备很强的竞争力，值得尝试申请。,您好，我有扎实的 Python 开发能力，熟悉大模型微调与计算机视觉落地，曾主导多个 AI 项目并获省级奖项，期待能有机会与您交流。
python开发工程师,8-12K,全职，要求3-5年，大专,共享有伞,广州,工作地点：广州--,https://www.zhipin.com/job_detail/84c2144760396a300nV929S5FFJX.html,boss,78,您的Python及AI相关技能与岗位高度匹配（85分），但工作年限未达3-5年要求（60分）。薪资范围合理，且具备AI背景有良好成长空间。,建议投递,技能匹配度高，项目经历丰富，虽工作年限稍欠，但具备培养潜力，值得尝试申请。,您好，我有扎实的Python开发及AI项目经验，熟悉大模型部署与CV应用，虽工作年限未达3年，但实战能力强，期待能加入贵司。
软件开发工程师（Java与Python）,7-10K,全职，要求1-3年，学历不限,恒晓信息,广州,工作地点：广州-天河区-黄村,https://www.zhipin.com/job_detail/acba7d35d5b61c370nR82dq6FlRQ.html,boss,77,您的 Java 和 Python 技能与岗位高度匹配（85分），项目经历丰富且涉及 AI 前沿技术。但简历未明确标注全职工作年限，经验相关性略低（60分），薪资期望与岗位范围匹配度高（90分）。,建议投递,技术栈完全对口，项目经历丰富且涉及 AI 前沿，虽缺乏明确全职经验但潜力较大，建议尝试。,您好，我有扎实的 Java/Python 开发基础，熟悉大模型部署与微服务架构，项目经验丰富，期待能加入贵司团队。
Python工程师（物联网/AI模型/YOLO方向）,10-15K,全职，要求3-5年，本科,能哥知识,广州,工作地点：广州-番禺区-大石,https://www.zhipin.com/job_detail/5aade3e62232548b03F52dW9GVdS.html,boss,76,您的 Python 与 YOLO 模型训练技能与岗位核心需求高度匹配（85分），但岗位要求本科及3-5年经验，您的大专学历及项目经验年限稍显不足（60分）。,可以考虑,技能栈高度契合 AI/物联网方向，但学历与工作年限未完全达标，建议作为备选尝试投递。,您好，我对贵司 Python/AI 岗位很感兴趣。我有扎实的 YOLO 模型训练与部署经验，曾主导计算机视觉检测项目，期待能有机会进一步沟通。
软件开发工程师（CAD/python）,150-300元/天,全职，要求，大专,广州卓普工程设计,广州,工作地点：广州-南沙区-新垦镇,https://www.zhipin.com/job_detail/f0b14cc7781209710nd52Ni1FlNR.html,boss,76,候选人精通Python及多种开发语言，项目经验丰富且获省级奖项，技能与岗位高度契合。虽未明确提及CAD开发经验，但具备工程类项目背景，学习迁移能力强。,建议投递,Python技能匹配度高，薪资在期望范围内，且候选人有竞赛获奖和开源项目，潜力较大。,您好，我是蒋睿，精通Python及工程系统开发，曾获人工智能大赛省一等奖，对CAD二次开发充满热情，期待加入贵司。
Python开发,10-12K,全职，要求1-3年，本科,中钦科技,广州,工作地点：广州-天河区-天河北,https://www.zhipin.com/job_detail/bce7731363adafbd0nB63dq5GVRZ.html,boss,76,您的Python及AI技能与岗位高度匹配（85分），项目经验丰富；但学历为大专且工作年限未明确达到1-3年要求，经验相关性略低（60分）。,可以考虑,技能栈非常契合，但学历和工作年限与硬性要求存在差距，建议作为备选尝试投递。,您好，我有扎实的Python开发及AI落地经验，曾主导人脸识别与巡检系统开发，虽学历为大专但实战能力强，期待能有机会沟通。
Python,20-40K,全职，要求经验不限，学历不限,优盟电子商务有限公司,广州,工作地点：广州-白云区-嘉禾,https://www.zhipin.com/job_detail/37ea2f3ad2f9d1c21HN629-6GVRX.html,boss,76,候选人精通 Python 及 AI 相关技术栈，项目经验与岗位高度契合，但作为应届生缺乏商业项目落地经验，薪资期望未明确需进一步沟通。,建议投递,技术栈匹配度高，竞赛获奖和项目经历证明学习能力强，虽经验尚浅但潜力巨大，值得争取。,您好，我是蒋睿，精通 Python 开发，有计算机视觉和大模型落地项目经验，曾获全国人工智能大赛一等奖，希望能有机会加入贵司。
python后端开发工程师（周末双休）,9-14K,全职，要求1-3年，本科,运捷迅,广州,工作地点：广州-白云区-机场路,https://www.zhipin.com/job_detail/eeb0718311862d9c0nBz2dm0EVZW.html,boss,75,您的 Python 技能与岗位高度匹配（85分），具备后端开发与数据库设计能力，但学历为大专且工作年限略低于 1-3 年要求（60分）。薪资期望未明确，但 9-14K 符合初级开发预期（90分）。,可以考虑,技能匹配度高，但学历和工作年限略低于硬性要求，建议作为备选投递。,您好，我有 Python 后端开发经验，熟悉数据库设计与接口开发，项目涉及人脸识别与管理系统，对贵岗位很感兴趣，期待进一步沟通。
Python,6-7K,全职，要求1-3年，学历不限,沃芙科技,广州,工作地点：广州-白云区-嘉禾,https://www.zhipin.com/job_detail/6e91d5a7e82bc3e51HFz3N-0EFZT.html,boss,75,候选人熟练掌握 Python 及多种开发技术，技能与岗位高度匹配（85分）。但项目多为校园/比赛性质，缺乏企业级实战经验，经验相关性略低（60分）。薪资范围 6-7K 符合应届生/初级开发者预期，匹配度高（90分）。,建议投递,技能栈完全覆盖岗位需求，薪资期望合理，虽然缺乏正式工作经验，但项目经历丰富且获奖众多，具备培养潜力，值得尝试。,您好，我精通 Python 开发，拥有多个 AI 与全栈项目实战经验，曾获省级人工智能大赛一等奖，对贵司岗位非常感兴趣，期待沟通。
Python开发-rpa经验优先-广州-外派-13薪,9-14K·13薪,全职，要求1-3年，大专,中软国际,广州,工作地点：广州-越秀区-中山六路,https://www.zhipin.com/job_detail/2dee0abb9088eb2c0nF63d69FVVQ.html,boss,75,候选人具备扎实的Python及多语言开发能力，且有计算机视觉与大模型项目经验，但RPA相关经验在简历中未明确体现，需进一步确认。,建议投递,技能基础匹配，项目经验较丰富，虽RPA经验待确认，但具备快速上手潜力，薪资范围符合预期。,您好，我有扎实的Python开发基础，熟悉OpenCV与大模型应用，对RPA领域有浓厚兴趣，希望能有机会加入贵团队。
python后端开发工程师,12-20K,全职，要求1-3年，大专,途南贸易,广州,工作地点：广州-海珠区-琶洲,https://www.zhipin.com/job_detail/e71ecf52010489761HJ63NS8FFpT.html,boss,75,您的 Python 技能与岗位高度匹配（85分），具备多个后端项目经验，但商业全职经验尚显不足（60分）。薪资期望未明确，但岗位范围合理（80分）。,建议投递,技能栈完全对口，项目经历丰富，虽缺乏全职经验但潜力较大，建议尝试申请。,您好，我有扎实的 Python 后端开发能力，熟悉数据库设计与接口开发，并有多个人工智能项目落地经验，期待加入贵司。
Python,12-20K,全职，要求3-5年，本科,广州研智博耀科技,广州,工作地点：广州-天河区-体育中心,https://www.zhipin.com/job_detail/2c1cfc07edf665370nBy2Ny7GVdV.html,boss,75,您的 Python 技能与 AI 项目经验（如人脸识别、大模型部署）高度匹配岗位要求（85分），但学历（大专）与工作年限（应届/实习）与岗位硬性要求（本科、3-5年）存在差距（60分）。,建议投递,虽然学历和经验年限未完全达标，但您的 AI 落地能力和竞赛获奖经历是显著加分项，建议尝试争取面试机会。,您好，我对贵司 Python 岗位很感兴趣。我有扎实的 Python 开发经验，并主导过人脸识别与大模型部署项目，曾获人工智能大赛一等奖，期待能有机会与您沟通。
python后端开发工程师,10-15K,全职，要求1-3年，本科,暄云信息科技,广州,工作地点：广州-番禺区-洛溪,https://www.zhipin.com/job_detail/5ebbdee7faf3e8dd0nV829i1E1ZT.html,boss,75,您的 Python 技能与岗位高度匹配（85分），具备大模型部署与后端开发经验。但岗位明确要求本科及1-3年经验，您目前为大专学历且经验主要源于项目，经验相关性得分较低（60分）。,建议投递,虽然学历和经验年限存在门槛，但您的 Python 技能栈与 AI 项目经验非常亮眼，具备较强的竞争力，值得尝试争取面试机会。,您好，我对贵司 Python 后端岗位很感兴趣。我有扎实的后端开发能力，并拥有大模型部署及计算机视觉项目经验，希望能有机会进一步沟通。
Python,10-12K,全职，要求1-3年，本科,山东浪潮数字服务,广州,工作地点：广州-天河区-天河北,https://www.zhipin.com/job_detail/faac05f62115f7430ndz0ti-EFRY.html,boss,75,您的 Python 及 AI 技能与岗位高度匹配（85分），项目经验亮眼；但学历为大专且缺乏正式全职经验，与本科及1-3年要求存在差距（60分）。,可以考虑,技能栈完全对口且项目丰富，但学历和工作年限未达硬性要求，建议作为备选尝试投递。,您好，我有扎实的 Python 和 AI 落地经验，主导过人脸识别及大模型巡检项目，虽为大专学历但实战能力强，期待能有机会面试沟通。
python+AI智能体讲师（双休+五险一金）,11-20K·13薪,全职，要求1-3年，大专,蜗牛学苑,广州,工作地点：广州-天河区-龙洞,https://www.zhipin.com/job_detail/85d62a4ef71cb6500nBz0t-6E1BZ.html,boss,75,您的 Python 和 AI 技能（大模型微调、CV）与岗位高度匹配（85分），但缺乏正式教学或企业级项目经验（60分）。薪资范围合理，职业成长空间较好。,建议投递,技术栈高度契合，虽缺乏教学经验，但竞赛获奖和项目经历可弥补，建议尝试申请。,您好，我有扎实的 Python 和 AI 项目经验，曾获人工智能大赛一等奖，熟悉大模型部署与微调，对讲师岗位充满热情，期待交流。
Python,7-12K,全职，要求1-3年，本科,新略信息,广州,工作地点：广州-天河区-天河北,https://www.zhipin.com/job_detail/2bc0669b697a5deb0nF62t25ElNR.html,boss,75,您的 Python 及 AI 相关技能（如大模型微调、OpenCV）与岗位高度匹配，但学历为大专且缺乏明确的全职工作年限，与岗位要求的本科及1-3年经验存在一定差距。,可以考虑,技术栈契合度高，但学历和经验年限未完全达标，建议作为备选投递，重点突出项目实战能力。,您好，我对贵司 Python 岗位很感兴趣。我有扎实的 Python 开发及 AI 项目落地经验（如人脸识别、大模型部署），虽学历为大专，但技术实战能力强，期待能有机会沟通。
Python后端开发工程师,8-13K,全职，要求1-3年，本科,广州绿字阳信息技...,广州,工作地点：广州-天河区-体育中心,https://www.zhipin.com/job_detail/fd2ee2cbfe361e8f1X143d26EVVU.html,boss,75,您的 Python 技能与岗位高度匹配，且具备 AI 与全栈开发能力，但学历为大专且缺乏明确的全职工作年限，与岗位要求的本科及 1-3 年经验存在一定差距。,建议投递,技能栈与岗位高度契合，项目经验扎实，虽然学历和经验年限略有不足，但具备较强的学习能力和 AI 背景，值得尝试申请。,您好，我有扎实的 Python 开发基础，熟悉后端接口与数据库设计，并拥有多个 AI 与全栈项目落地经验，希望能有机会加入贵司。
python开发工程师,12-18K,全职，要求1-3年，本科,广交数科,广州,工作地点：广州-黄埔区-大沙,https://www.zhipin.com/job_detail/9ed31ee60ba0a7780nB53dy_GFdW.html,boss,75,您的Python及AI相关技能与岗位高度匹配（85分），但学历为大专且缺乏明确的企业工作年限，经验相关性略低（60分）。,可以考虑,技能栈契合度高，但学历和经验年限未完全达标，建议作为备选尝试投递。,您好，我有扎实的Python开发及AI落地经验，熟悉大模型部署与视觉检测，虽学历为大专但项目实战能力强，期待有机会沟通。
