title,salary,requirements,company,city,description,link,source,match_score,match_reason,recommendation,recommendation_reason,greeting
ai应用训练师,5-10K·13薪,全职，要求1-3年，本科,深圳元镜视界科技,广州,工作地点：广州-花都区-花山,https://www.zhipin.com/job_detail/165df41c761bf1ae0nZ-29m0EFtY.html,boss,0,简历内容为空，无法提取核心技能、工作年限及主要成就，无法与岗位要求进行有效匹配分析。,不推荐,由于简历内容缺失，无法评估候选人是否满足1-3年经验及本科要求，建议补充完整简历后再进行评估。,您好，我对贵司AI应用训练师岗位非常感兴趣。因简历内容尚未完善，期待能有机会补充详细经历并进一步沟通。
AI训练师实习生【实习4个月及以上】,80-130元/天,全职，要求，本科,励丰文化科技,广州,工作地点：广州-黄埔区-科学城,https://www.zhipin.com/job_detail/e72ab10c755fa0210nB43dq9F1RZ.html,boss,0,您未提供简历内容，无法提取核心技能、工作年限及主要成就，因此无法评估与AI训练师实习生岗位（要求本科、全职、实习4个月以上）的匹配度。,不推荐,由于简历内容缺失，无法进行有效的人岗匹配分析，建议补充完整简历后再进行评估。,您好，我对励丰文化的AI训练师实习生岗位非常感兴趣，但简历信息尚未完善，希望能补充后进一步沟通。
智能训练师,12-18K,全职，要求1-3年，大专,跑红集团,广州,工作地点：广州--,https://www.zhipin.com/job_detail/859130e2529c8ab80nZz09W4EVBZ.html,boss,0,未提供简历内容，无法提取核心技能、工作年限及主要成就，因此无法评估与智能训练师岗位的匹配度。,不推荐,由于简历内容为空，无法进行有效的岗位匹配分析，建议补充完整简历信息后再进行评估。,您好，我注意到贵司正在招聘智能训练师，但我目前尚未上传简历。希望能补充我的相关经验与技能，期待与您进一步沟通。
AI视觉训练师,25-40K·13薪,全职，要求3-5年，本科,SHEIN,广州,工作地点：广州-番禺区-市桥,https://www.zhipin.com/job_detail/8c42f6d4da02afc20nBz3du1EVZX.html,boss,0,未提供简历内容，无法提取核心技能、工作年限及主要成就，无法进行有效匹配分析。,不推荐,由于简历内容为空，无法评估候选人资质，建议补充完整简历后再进行投递评估。,您好，我对SHEIN的AI视觉训练师岗位非常感兴趣，具备相关视觉算法与模型训练经验，期待能有机会进一步沟通。
数据标注/AI训练师,5-6K,全职，要求1-3年，本科,Vising珠宝,广州,工作地点：广州-荔湾区-陈家祠,https://www.zhipin.com/job_detail/0915bc6b771871a90nR42tq6GVNR.html,boss,0,您未提供简历内容，无法提取核心技能、工作年限及主要成就，因此无法进行匹配度分析。,不推荐,由于缺少简历信息，无法评估候选人是否符合岗位对1-3年经验及本科学历的要求。,您好，我对贵司数据标注/AI训练师岗位很感兴趣，但您未提供简历，请补充简历以便我为您评估匹配度。
