title,salary,requirements,company,city,description,link,source,match_score,match_reason,recommendation,recommendation_reason,greeting
中级python后端开发工程师,10-15K,全职，要求1-3年，本科,从简智能科技,广州,工作地点：广州-天河区-猎德,https://www.zhipin.com/job_detail/8ac72ca5575a39a01HF43924E1RW.html,boss,75,您的 Python 技能与岗位高度匹配（85分），项目经验涉及后端开发与 AI 应用，但学历为大专且缺乏明确的全职工作年限，与中级岗位要求（本科、1-3年经验）存在一定差距。,可以考虑,技术栈匹配度高，但学历和经验年限略低于岗位硬性要求，建议作为备选投递，重点突出项目实战能力。,您好，我对贵司 Python 后端岗位很感兴趣。我有扎实的 Python 开发基础，主导过多个 AI 与后端结合的项目，期待能有机会展示我的实战能力。
Python业务自动化开发,6-9K,全职，要求1年以内，本科,广州勒恩商贸有限公司,广州,工作地点：广州-海珠区-客村,https://www.zhipin.com/job_detail/5a91d220292ba6a90nF70929FVpS.html,boss,75,候选人掌握Python及多种开发技能，项目经验丰富，但岗位明确要求本科学历，候选人学历为大专，存在硬性门槛差异。,建议投递,虽然学历未完全达标，但技能栈与岗位高度契合，且薪资期望在范围内，建议尝试申请。,您好，我有扎实的Python开发基础及多个AI与全栈项目经验，能快速上手业务自动化开发，期待与您进一步沟通。
Python开发工程师（兼职）,7-8K,全职，要求1-3年，大专,殷赋科技,广州,工作地点：广州-番禺区-钟村,https://www.zhipin.com/job_detail/d1d5e23c5d065ca903B70tu0GFU~.html,boss,75,您的 Python 及 AI 相关技能与岗位高度匹配（85分），但工作年限（应届/实习）低于岗位要求的 1-3 年（60分），薪资期望未明确但符合市场区间。,可以考虑,技能匹配度高且具备 AI 项目经验，但工作年限未达硬性要求，建议作为备选或争取实习/试用期机会。,您好，我有扎实的 Python 开发及大模型部署经验，曾主导人脸识别与机器人巡检项目，虽为应届生但能快速上手，期待沟通。
python,10-15K,全职，要求1-3年，本科,广连软件,广州,工作地点：广州-天河区-车陂,https://www.zhipin.com/job_detail/2d979e06cc04c55f0nZ42d27E1ZY.html,boss,75,候选人掌握 Python 及 AI 相关技能，与岗位高度匹配（85分），但学历为大专且工作年限可能不足1年，与岗位要求的本科及1-3年经验存在差距（60分）。,建议投递,技能匹配度高，且有相关竞赛获奖和项目经验，建议尝试投递，但需做好学历和经验门槛的沟通准备。,您好，我精通 Python 开发，有计算机视觉与大模型微调实战经验，曾获人工智能大赛一等奖，期待能有机会加入广连软件。
Python,15-30K·14薪,全职，要求经验不限，本科,华为云计算,广州,工作地点：广州-白云区-金沙洲,https://www.zhipin.com/job_detail/17248b96e5656c0003d72du6FlBZ.html,boss,75,候选人掌握 Python 及 AI 相关技能，与岗位高度匹配（85分），但学历为大专，与岗位要求的本科存在硬性差距，影响经验相关性评分。,建议投递,技能匹配度高，项目经验丰富，但学历未达硬性要求，建议尝试投递并突出技术优势。,您好，我有扎实的 Python 开发及 AI 落地经验，曾获人工智能大赛一等奖，虽学历为大专，但技术实力过硬，期待能有机会沟通。
python后端开发（接受转语言）,15-30K·17薪,全职，要求1-3年，本科,LesPark,广州,工作地点：广州-天河区-沙河,https://www.zhipin.com/job_detail/2f8a98f87d1ec9310nBy29W1GFFR.html,boss,74,候选人Python技能扎实且具备AI项目经验，与岗位技术栈高度契合；但学历为大专且缺乏正式商业项目经验，与岗位本科及1-3年经验要求存在差距。,可以考虑,技术栈对口且有AI加分项，但学历和经验年限略低于岗位硬性要求，建议作为备选尝试。,您好，我精通Python及后端开发，拥有多个AI与全栈项目落地经验，GitHub有开源代码，对贵司业务很感兴趣，期待进一步沟通。
python后端开发工程师,8-10K,全职，要求3-5年，大专,品推科技,广州,工作地点：广州-番禺区-市桥,https://www.zhipin.com/job_detail/6b6d34b54ba48bcb1XB93Nu0GVJY.html,boss,73,您的Python技能与岗位高度匹配（85分），且具备AI与大模型相关项目经验，但岗位要求3-5年经验，您目前主要为项目/竞赛经历，经验相关性得分较低（40分）。,可以考虑,技术栈高度匹配且年轻有潜力，但工作年限未达标，建议作为潜力股尝试投递。,您好，我对贵司Python后端岗位很感兴趣。我精通Python及AI相关技术，曾获人工智能大赛一等奖，虽工作年限尚浅，但项目实战经验丰富，期待有机会沟通。
python开发（RPA维护）工程师,15-20K,全职，要求1-3年，本科,省事熊,广州,工作地点：广州-黄埔区-科学城,https://www.zhipin.com/job_detail/aa004176efb1c78a1XF639W-EVdU.html,boss,72,您的 Python 技能与岗位高度匹配（80分），具备大模型与计算机视觉项目经验，但学历为大专且缺乏 1-3 年全职商业项目经验，经验相关性略低（60分）。,建议投递,技能栈与 RPA 及 Python 开发高度契合，虽学历和经验年限有差距，但项目成果丰富，值得尝试申请。,您好，我有扎实的 Python 开发能力，熟悉 RPA 自动化逻辑，拥有多个 AI 与视觉项目落地经验，希望能有机会加入贵司。
Python讲师（线上居家办公）,11-15K,全职，要求经验不限，本科,成都燃点未来教育咨询,广州,工作地点：广州-天河区-东圃,https://www.zhipin.com/job_detail/b632e73810c8e6bd03152tq-EFJZ.html,boss,72,您的 Python 和 AI 技能与讲师岗位高度匹配（85分），但学历为大专，与岗位要求的本科存在差距，且缺乏正式教学或企业工作经验。,可以考虑,技能匹配度高，但学历和经验是主要短板，建议作为备选尝试投递。,您好，我精通 Python 及 AI 技术，拥有多个落地项目经验及竞赛奖项，虽学历为大专，但具备极强的实战与表达能力，期待能胜任线上讲师岗位。
Python工程师,6-8K,全职，要求1-3年，大专,若宇网,广州,工作地点：广州-番禺区-南村,https://www.zhipin.com/job_detail/a5fa53ec1748e5621nVy29S8FVJR.html,boss,72,您的Python技能与岗位高度匹配（85分），项目经历丰富且涉及AI方向，但工作年限（应届生/实习）低于岗位要求的1-3年（40分）。薪资范围6-8K符合应届生预期（90分），且岗位提供AI相关成长空间（80分）。,可以考虑,技能匹配度高且项目经历亮眼，但工作年限未达标，建议作为潜力型候选人投递。,您好，我有扎实的Python及AI项目经验，曾获人工智能大赛一等奖，虽工作年限未达1年，但技术能力匹配，期待有机会沟通。
Python 全栈开发（AI Agent方向）,15-20K,全职，要求1-3年，本科,重庆达瓦合志,广州,工作地点：广州-天河区-棠下,https://www.zhipin.com/job_detail/8a6b1e5ba79d7cae0nF73d-1FVpQ.html,boss,70,您的 Python 和 AI 技能与岗位高度匹配（85分），但学历为大专且缺乏 1-3 年全职工作经验（50分），薪资期望未明确且岗位薪资偏高（60分）。,可以考虑,技能栈契合度高，但学历和经验年限存在差距，建议作为备选尝试投递。,您好，我对贵司 Python 全栈开发岗位很感兴趣。我有扎实的 Python 和 AI 项目经验，熟悉大模型部署与全栈开发，希望能有机会进一步沟通。
python量化交易程序员,6-8K,全职，要求1年以内，本科,广州龙智,广州,工作地点：广州-荔湾区-陈家祠,https://www.zhipin.com/job_detail/c9a2a8f1668cbaaf03N62dW9F1pZ.html,boss,70,候选人掌握Python及AI相关技能，与岗位技术栈部分匹配（70分），但缺乏量化交易领域经验。薪资期望未明确，但岗位6-8K符合初级开发者水平（80分）。,可以考虑,技能基础扎实且有竞赛获奖，但学历为大专（岗位要求本科）且缺乏量化交易经验，建议作为备选投递。,您好，我有扎实的Python开发及AI项目经验，曾获人工智能大赛一等奖，对量化交易领域充满热情，希望能有机会进一步沟通。
python在线兼职,2-3K,全职，要求1年以内，大专,明冬教育,广州,工作地点：广州-天河区-沙河,https://www.zhipin.com/job_detail/cbbb5ec206ac7db103V_3Nq-EFNU.html,boss,70,您的 Python 技能与岗位高度匹配（90分），具备大模型部署与计算机视觉项目经验，远超兼职岗位基础要求。但岗位为低薪兼职，职业成长空间有限（40分）。,可以考虑,技能完全胜任，但薪资较低且为兼职性质，适合作为过渡或练手，不建议作为长期职业规划。,您好，我有扎实的 Python 开发及 AI 项目落地经验，熟悉大模型微调与视觉算法，希望能利用业余时间协助团队，期待沟通。
python开发工程师,15-25K,全职，要求经验不限，学历不限,多益网络,广州,工作地点：广州-黄埔区-中心城,https://www.zhipin.com/job_detail/d1fc5aa41b586fec03J-39y5E1ZU.html,boss,70,候选人Python技能扎实且具备AI/视觉项目经验，与岗位要求高度匹配；但缺乏商业项目落地经验，薪资期望未明确且岗位起薪较高，需进一步沟通。,可以考虑,技能匹配度高，但商业经验不足，薪资需确认，建议作为备选投递。,您好，我对贵司Python开发岗位很感兴趣。我有扎实的Python基础，并主导过人脸识别、大模型巡检等AI项目，获过省级一等奖，期待能有机会沟通。
python全栈工程师,10-15K,全职，要求3-5年，大专,睿烨科技,广州,工作地点：广州-番禺区-石基,https://www.zhipin.com/job_detail/01799dff81ceb0aa03J_2tq6EVRV.html,boss,70,您的 Python 及全栈开发技能与岗位高度匹配（80分），项目经验涵盖 AI 与系统开发，但工作年限（应届/初级）与岗位要求的 3-5 年存在差距（60分）。,可以考虑,技术栈契合度高且具备 AI 落地能力，但工作年限未达硬性要求，建议作为备选或争取初级岗机会。,您好，我有扎实的 Python 全栈开发经验，熟悉大模型部署与 CV 应用，GitHub 有多个落地项目，希望能争取面试机会。
python实习生,100-150元/天,全职，要求，硕士,乾伽脑科,广州,工作地点：广州-番禺区-大学城,https://www.zhipin.com/job_detail/d3630a33c4371c1e03d82t64EVpW.html,boss,70,您的 Python 及 AI 相关技能与岗位高度匹配（85分），项目经验也具备相关性（80分），但岗位明确要求硕士学历，而您为大专学历，存在硬性门槛差距。,不推荐,虽然技能匹配度高，但岗位硬性要求硕士学历，您的学历背景不符合招聘门槛，建议寻找对学历限制较宽松或更看重实际能力的岗位。,您好，我对贵司 Python 实习岗位很感兴趣。我有扎实的 Python 基础及大模型部署经验，曾负责过人脸识别等项目，希望能有机会展示我的技术能力。
AI全栈开发工程师（Python/Node.js）,11-20K,全职，要求3-5年，本科,软通众擎,广州,工作地点：广州-海珠区-琶洲,https://www.zhipin.com/job_detail/3c7ac979a5c276430nB63NS5EFNS.html,boss,70,您的Python及AI技能与岗位高度匹配，具备全栈开发能力，但工作年限（约1-2年）与要求的3-5年存在差距，学历为大专。,可以考虑,虽然技能和项目经验亮眼（含全国大赛一等奖），但硬性条件（学历、年限）未完全达标，建议尝试投递争取破格机会。,您好，我对AI全栈岗位很感兴趣。我有Python及大模型部署经验，曾获全国人工智能大赛一等奖，熟悉全栈开发，期待有机会沟通。
Python,15-16K,全职，要求1-3年，本科,蓝鲲智创,广州,工作地点：广州--,https://www.zhipin.com/job_detail/d966b2c4c329617b0nV529S9FlpR.html,boss,70,您的 Python 及 AI 相关技能与岗位高度匹配（85分），但学历为大专且缺乏明确商业项目经验，与本科及1-3年要求存在差距（60分）。薪资期望未明确，但15-16K对应届生偏高（50分）。,可以考虑,技能栈对口但学历和经验年限未达硬性要求，建议作为备选投递，重点突出项目实战能力。,您好，我有扎实的 Python 开发及大模型部署经验，曾获人工智能大赛一等奖，虽为大专学历但项目实战能力强，期待能有机会沟通。
软件开发(Python/C++ c端产品开发履历),15-30K,全职，要求3-5年，本科,某大型国际人工智能科技上市公司,广州,工作地点：广州--,https://www.zhipin.com/job_detail/741df14f4379a4210nR83N-5EFtT.html,boss,68,技能栈高度匹配（Python/C++/AI），项目经验扎实且获全国大赛一等奖；但学历为大专且工作年限可能不足3年，与岗位硬性要求存在差距。,可以考虑,虽然技能与项目经验非常契合，但学历和工作年限未达到岗位硬性要求，建议作为备选尝试投递，重点突出技术亮点。,您好，我对贵司Python/C++开发岗位非常感兴趣。我有扎实的Python/C++基础，主导过人脸识别及大模型巡检项目，获全国人工智能大赛一等奖，期待能有机会展示我的技术实力。
Python 开发工程师,12-15K,全职，要求3-5年，本科,猪猪网,广州,工作地点：广州-天河区-东圃,https://www.zhipin.com/job_detail/6ceb54b651ed83130nBy3tm7ElpU.html,boss,68,候选人掌握 Python 及 AI 相关技能，与岗位技术栈高度匹配（85分），但学历为大专且缺乏明确商业项目年限，经验匹配度较低（50分）。,建议投递,虽然学历和经验年限未完全达标，但技能栈高度契合且具备 AI 落地项目经验，值得尝试争取面试机会。,您好，我精通 Python 开发，拥有大模型部署及计算机视觉项目落地经验，GitHub 有相关开源项目，希望能有机会与您沟通。
Python开发工程师,15-28K,全职，要求1-3年，大专,城北,广州,工作地点：广州-海珠区-新港西路沿线,https://www.zhipin.com/job_detail/db1f04ab347372f71XF409q_EFQ~.html,boss,68,您的 Python 及 AI 技能与岗位高度匹配（85分），但简历显示为在校/应届项目经验，缺乏 1-3 年商业项目实战，经验相关性较低（50分）。薪资范围 15-28K 对应届生偏高，需评估竞争力。,可以考虑,技术栈匹配度高且具备 AI 竞赛获奖优势，但工作经验不足且薪资期望可能超出应届水平，建议作为备选尝试投递。,您好，我精通 Python 及大模型部署，曾获全国人工智能大赛一等奖，有完整项目落地经验，对贵司岗位很感兴趣，期待沟通。
python,20-30K,全职，要求3-5年，本科,广州冠玉科技有限公司,广州,工作地点：广州-白云区-三元里,https://www.zhipin.com/job_detail/7c8ed978527fba990nZ72N2_FFJZ.html,boss,68,候选人掌握 Python 及 AI 相关技能，与岗位技术栈高度匹配（85分），但学历为大专且缺乏明确商业项目经验，与岗位要求的 3-5 年经验及本科学历存在差距（50分）。,可以考虑,技能匹配度较高，但学历和经验年限未完全达标，建议作为备选尝试投递。,您好，我精通 Python 及大模型部署，拥有多个 AI 项目实战经验，虽学历为大专，但技术栈与贵司岗位高度契合，期待有机会沟通。
Python开发工程师,11-20K,全职，要求3-5年，大专,海颐软件,广州,工作地点：广州--,https://www.zhipin.com/job_detail/34d23df5b7a5794b0nBy2d66E1RT.html,boss,67,您的 Python 技能与岗位高度匹配（85分），具备大模型部署、计算机视觉等前沿技术经验。但岗位要求 3-5 年经验，您目前主要为项目/竞赛经历，工作经验相关性较低（40分）。,可以考虑,技能栈与岗位高度契合，但工作年限未达硬性要求，建议作为备选或争取实习/初级岗位机会。,您好，我有扎实的 Python 开发基础，熟悉大模型微调与 OpenCV，曾获人工智能大赛一等奖，对贵司岗位很感兴趣，期待进一步沟通。
AI Python,13-17K,全职，要求3-5年，大专,CLPS华钦软件,广州,工作地点：广州-天河区-石牌,https://www.zhipin.com/job_detail/96d98f035dfc408d0nB92di7EFVQ.html,boss,67,您的 Python 和 AI 技能（大模型、CV）与岗位高度匹配（85分），但岗位要求 3-5 年经验，您的实际工作年限可能不足（40分），薪资期望未明确但岗位范围合理。,可以考虑,技能匹配度高，但工作年限未达标，建议作为潜力型候选人尝试投递。,您好，我对 AI Python 岗位很感兴趣。我精通 Python 及大模型部署，曾获全国人工智能大赛一等奖，具备扎实的 CV 落地经验，期待能有机会与您沟通。
后端开发工程师（Python方向）,12-18K·13薪,全职，要求3-5年，本科,引力波信息科技,广州,工作地点：广州-番禺区-汉溪,https://www.zhipin.com/job_detail/0672acdd207de70a0nR829y-FVZV.html,boss,65,您的 Python 技能与岗位高度匹配（85分），具备大模型部署与后端开发经验，但学历（大专）与工作年限（应届/无全职）未达硬性要求（本科、3-5年），经验相关性较低（40分）。,可以考虑,技能栈与岗位需求高度契合，但学历和工作经验存在硬性差距，建议作为备选尝试投递，或关注对学历包容度更高的岗位。,您好，我精通 Python 及大模型部署，拥有多个 AI 与后端项目落地经验，虽为应届生但技术扎实，希望能争取一个面试机会。
python,13-18K,全职，要求3-5年，本科,京北方,广州,工作地点：广州-白云区-机场路,https://www.zhipin.com/job_detail/27e3b3b120bffbd31HN429y9FVRV.html,boss,65,候选人掌握Python、数据库及AI相关技能，技术栈与岗位高度匹配（85分）。但学历为大专且缺乏3-5年全职工作经验，经验相关性较低（40分）。薪资期望未明确，但岗位13-18K对初级开发者有一定吸引力。,可以考虑,虽然技能匹配度高且有大模型/计算机视觉项目经验，但学历和工作经验未达硬性要求，建议作为备选尝试投递。,您好，我精通Python及大模型微调，有计算机视觉与机器人巡检项目实战经验，虽为应届生但技术扎实，期待能有机会加入京北方。
Python 全栈开发,10-15K,全职，要求3-5年，本科,RAXEN.CO,广州,工作地点：广州-海珠区-赤岗,https://www.zhipin.com/job_detail/77a711307a6e12810XZ_3dW0FlE~.html,boss,65,您的 Python 及全栈技能与岗位高度匹配（85分），但岗位要求 3-5 年经验及本科学历，您目前为大专学历且缺乏商业项目经验（40分），薪资期望在合理范围内。,可以考虑,技术栈匹配度高，但学历与工作年限未达硬性要求，建议作为潜力候选人尝试投递。,您好，我对 Python 全栈开发岗位很感兴趣。我有扎实的 Python 及 AI 项目落地经验，熟悉前后端开发，希望能有机会与您沟通。
python算法工程师,10-15K,全职，要求3-5年，本科,景汇士信息科技,广州,工作地点：广州-天河区-石牌,https://www.zhipin.com/job_detail/53d57aad73d4672b0nRz29q_GVFZ.html,boss,65,您的 Python 和 AI 项目经验与岗位技能要求匹配度较高（75分），但学历为大专且工作年限不足3年，与岗位硬性要求存在差距（50分）。,可以考虑,虽然技能匹配，但学历和工作年限未达到岗位硬性要求，建议作为备选尝试投递。,您好，我有扎实的 Python 和 AI 项目落地经验，曾获人工智能大赛一等奖，虽学历为大专，但技术热情高，期待有机会沟通。
python开发工程师,10-12K,全职，要求3-5年，本科,伽睿,广州,工作地点：广州-天河区-石牌,https://www.zhipin.com/job_detail/c636e2ec1319153503N709y5FFNZ.html,boss,65,您的 Python 及 AI 相关技能与岗位高度匹配（85分），但学历为大专且缺乏 3-5 年全职工作经验（40分），与硬性要求存在差距。,可以考虑,技能栈契合度高，但学历和工作年限未达硬性标准，建议作为备选尝试投递。,您好，我对 Python 开发岗位很感兴趣。我有扎实的 Python 及 AI 项目落地经验，曾获人工智能大赛一等奖，期待能有机会与您沟通。
Python后端开发工程师,8-10K,全职，要求1-3年，本科,莫生气科技,广州,工作地点：广州-天河区-东圃,https://www.zhipin.com/job_detail/78e673ce179c497a0nd839u1FlJV.html,boss,65,候选人掌握 Python 及 AI 相关技能，与岗位技术栈匹配度较高（75分），但学历为大专且缺乏 1-3 年正式工作经验，经验相关性较低（40分）。薪资期望在岗位范围内，但硬性条件存在差距。,可以考虑,虽然技能匹配且薪资合理，但学历和经验年限未完全达到岗位要求，建议作为备选尝试投递，重点突出项目实战能力。,您好，我有扎实的 Python 开发基础及多个 AI 项目实战经验，熟悉后端接口与数据库设计，虽为应届生但学习能力强，希望能争取面试机会。
Python自动化测试,5-8K,全职，要求1-3年，本科,正穗软件,广州,工作地点：广州-天河区-东圃,https://www.zhipin.com/job_detail/04757082162fc5071nR_3t-7FFZT.html,boss,65,Python 技能扎实且具备 AI 项目经验，技术栈匹配度高；但缺乏 1-3 年正式工作经验且学历为大专，与岗位硬性要求存在差距。,可以考虑,技能基础良好但经验与学历未达硬性门槛，适合作为初级岗位或实习机会尝试。,您好，我精通 Python 且有多个 AI 与全栈项目落地经验，曾获人工智能大赛一等奖。虽为应届生，但具备扎实的自动化测试脚本编写能力，希望能有机会面试。
python后端开发工程师,11-18K,全职，要求3-5年，大专,八维擎天,广州,工作地点：广州-天河区-东圃,https://www.zhipin.com/job_detail/0685d2f713ad346c0nR529u8EFtW.html,boss,65,您的Python及后端开发技能与岗位高度匹配（80分），但岗位明确要求3-5年经验，您目前仅有项目经验，工作年限匹配度较低（40分）。薪资范围11-18K对应届生较合理，但需结合能力评估。,可以考虑,技术栈对口且有大模型项目经验，但工作年限未达硬性要求，建议作为备选或争取初级/实习岗位。,您好，我有扎实的Python后端开发能力，熟悉大模型部署与CV项目，虽工作年限未达3年，但项目经验丰富，希望能争取面试机会。
python全栈开发,10-15K,全职，要求3-5年，本科,前鹰科技,广州,工作地点：广州-白云区-白云大道,https://www.zhipin.com/job_detail/6a46eeb7794ca4df0nF72tW6EFVT.html,boss,65,您的 Python 及全栈技能与岗位高度匹配（80分），但岗位要求 3-5 年经验及本科学历，您的实际工作年限和学历存在差距（40分）。,可以考虑,虽然技能栈匹配且具备 AI 项目亮点，但硬性条件（学历、年限）未达标，建议作为备选或尝试沟通。,您好，我精通 Python 全栈开发及大模型部署，有机器人巡检等落地项目经验，虽年限尚浅但技术扎实，期待有机会沟通。
兼职——AI+Python开发工程师,10-15K,全职，要求3-5年，本科,魔方网表,广州,工作地点：广州-海珠区-江南大道,https://www.zhipin.com/job_detail/bdc92f6d2f27bae703R83t69FVVX.html,boss,65,您的Python与AI技能栈高度匹配岗位需求（85分），但学历为大专且缺乏3-5年商业项目经验，硬性条件存在差距。,可以考虑,技术能力突出且有竞赛获奖，但学历与年限要求不符，建议作为备选尝试沟通。,您好，我对AI+Python开发岗位很感兴趣。我有大模型部署与CV项目经验，获过人工智能大赛一等奖，希望能有机会沟通。
Python游戏开发工程师（包餐/双休）,9-12K·15薪,全职，要求1-3年，本科,红石创想,广州,工作地点：广州-天河区-车陂,https://www.zhipin.com/job_detail/e3d64b45ddb112f00ndz2tm9E1tV.html,boss,65,候选人掌握Python及Unity3D，与游戏开发技能栈有重叠，但缺乏正式商业项目经验，且学历为大专，与岗位要求的本科及1-3年经验存在差距。,可以考虑,技能栈有一定匹配度，但学历和经验是主要短板，建议作为备选投递，重点突出AI与游戏结合的项目亮点。,您好，我对贵司Python游戏开发岗位很感兴趣。我有Python和Unity3D开发经验，并熟悉AI模型部署，希望能有机会进一步沟通。
金融量化编程师 Python Pine,50-150元/时,全职，要求经验不限，学历不限,福州鼓楼瑞宽信息...,广州,工作地点：广州-天河区-东圃,https://www.zhipin.com/job_detail/7940e2b00f25c00d03R439m_GFFU.html,boss,65,候选人精通Python且具备AI落地经验，但缺乏金融量化及Pine Script相关背景，技能匹配度中等。薪资按小时计费，对初级开发者较友好，但岗位经验不限，竞争可能较激烈。,可以考虑,Python基础扎实，但量化领域经验不足，可作为转行或学习机会尝试投递。,您好，我精通Python及AI模型部署，有扎实的编程基础，对量化交易感兴趣，希望能有机会参与贵司项目，期待您的回复。
