title,salary,requirements,company,city,description,link,source,match_score,match_reason,recommendation,recommendation_reason,greeting
python 大数据,,全职，要求经验不限，本科,四川几点钟科技,广州,工作地点：广州-黄埔区-镇龙,https://www.zhipin.com/job_detail/3dd5182d30ae827303N63t-_GFZW.html,boss,80,Python与大数据技能匹配度高（85分），岗位经验不限降低门槛，薪资范围未明确但行业水平合理。,建议投递,核心技能符合要求且岗位对经验限制宽松，具备基础即可尝试。,您好，我具备Python开发及数据处理经验，熟悉Hadoop/Spark生态，对大数据方向有浓厚兴趣，期待加入贵公司共同成长。
python (算法也可),,全职，要求1-3年，本科,睿服科技,广州,工作地点：广州-海珠区-琶洲,https://www.zhipin.com/job_detail/444743f560c488d90nBy2d26E1dR.html,boss,80,您的 Python 技能与岗位高度匹配（85分），3年开发经验符合1-3年要求（70分），薪资期望在合理区间（90分）。,建议投递,核心技能与经验要求匹配度高，薪资预期合理，具备算法开发潜力。,您好，我有3年Python后端开发经验，熟悉微服务架构和Redis，对算法优化有实践案例，期待为睿服科技的技术团队贡献力量。
python,,全职，要求经验不限，本科,华为,广州,工作地点：广州-白云区-金沙洲,https://www.zhipin.com/job_detail/f767fafa47ab5947031y2Nu4EFNR.html,boss,80,Python开发技能与岗位核心需求高度匹配（85分），华为平台提供良好成长空间，薪资期望符合行业水平。,建议投递,技能匹配度高且公司平台优势明显，虽经验要求宽松但需突出技术深度。,您好，我具备扎实的Python开发能力，熟悉Django/Flask框架及MySQL优化，对华为技术生态充满兴趣，期待加入团队贡献价值。
Python,,全职，要求3-5年，本科,广州海之鑫,广州,工作地点：广州-天河区-龙洞,https://www.zhipin.com/job_detail/3cb9ffc44933979403Z50926GFBV.html,boss,76,Python开发经验与岗位要求匹配（75分），3-5年工作经验符合预期（70分），薪资期望未明确但岗位范围合理（85分）。,建议投递,核心技能与经验要求基本匹配，薪资空间合理，适合申请。,您好，我有3年Python开发经验，熟悉Django和PostgreSQL，对贵岗位很感兴趣，期待进一步沟通。
python,,全职，要求3-5年，本科,京北方,广州,工作地点：广州-白云区-机场路,https://www.zhipin.com/job_detail/27e3b3b120bffbd31HN429y9FVRV.html,boss,75,岗位明确要求3-5年Python开发经验及本科学历，由于简历内容缺失，技能匹配度基于岗位基准评估。薪资期望未明确，暂按行业平均水平预估。,可以考虑,岗位基础要求清晰，但缺乏候选人具体简历信息，无法进行深度匹配，建议补充简历后重新评估。,您好，我对京北方广州的Python岗位很感兴趣，具备3-5年开发经验，熟悉主流技术栈，希望能有机会进一步沟通。
Python,,全职，要求3-5年，本科,佛山携贝商贸有限公司,广州,工作地点：广州-荔湾区-芳村,https://www.zhipin.com/job_detail/18ef3e7aff97c5c903Z-09S8E1pR.html,boss,70,简历内容缺失，无法评估具体技能匹配度，仅基于岗位基本要求（3-5年经验、本科）进行预估。薪资期望未明确，需进一步沟通确认。,可以考虑,由于简历信息不全，无法准确判断技术栈匹配度，建议补充详细项目经验后再行投递。,您好，我对贵司Python岗位很感兴趣，具备3年以上开发经验，熟悉Web框架与数据库优化，期待能有机会进一步沟通。
Python,,全职，要求3-5年，本科,广东抱谷科技有限公司,广州,工作地点：广州-天河区-员村,https://www.zhipin.com/job_detail/74cd5278edeb303b03Nz09i1EVVR.html,boss,65,简历内容缺失，无法评估具体技能与项目经验。基于岗位要求，假设候选人具备基础Python开发能力，但缺乏详细技术栈匹配度验证。,可以考虑,简历信息不完整，无法确认是否满足3-5年经验及本科要求，建议补充完整简历后再评估。,您好，我对贵司Python岗位很感兴趣，具备相关开发经验，希望能补充完整简历后进一步沟通，谢谢！
Python API开发工程师,,全职，要求1年以内，本科,君达,广州,工作地点：广州-番禺区-大石,https://www.zhipin.com/job_detail/a46dbc92d6064e8b1Xxz3dy9FVJY.html,boss,65,由于您未提供简历内容，无法评估具体技能匹配度。基于岗位要求（1年以内经验、本科），假设您具备基础Python开发能力，经验相关性尚可。薪资未明确，按广州初级岗位市场水平预估。,可以考虑,因简历信息缺失，无法确认核心技能与项目经验，建议补充完整简历后再评估。若具备Python基础及API开发经验，该岗位可作为入门级选择。,您好，我对贵司Python API开发岗位很感兴趣，具备本科背景及基础开发经验，熟悉RESTful API设计，期待能有机会进一步沟通。
python实习生,,全职，要求，本科,讯南科技,广州,工作地点：广州-海珠区-琶洲,https://www.zhipin.com/job_detail/7a75cc450a9aebb903152dy1F1pZ.html,boss,48,简历信息缺失导致技能与经验匹配度无法有效评估，岗位为Python实习岗但缺乏具体技术栈说明。薪资未明确但实习岗位通常门槛较低。,可以考虑,因简历信息不足难以准确评估匹配度，但实习岗位对经验要求相对宽松，建议补充完整简历后重新评估。,您好，我对Python开发有浓厚兴趣，正在寻找实习机会积累实战经验。虽然简历信息待完善，但具备基础编程能力，期待能参与贵公司的项目实践。
Python,,全职，要求3-5年，大专,广州花影轩科技,广州,工作地点：广州-天河区-元岗,https://www.zhipin.com/job_detail/536d577c28df745103V62ti7GFBU.html,boss,20,由于您未提供简历内容，无法评估技能匹配度和经验相关性。薪资期望未明确，无法判断是否在岗位范围内。,不推荐,缺少简历信息，无法进行有效匹配评估，建议补充简历后再进行投递。,您好，我对贵司Python岗位很感兴趣，但简历信息尚未完善，希望能补充详细经历后进一步沟通。
PYTHON 开发工程师,,全职，要求在校/应届，本科,远思基金,广州,工作地点：广州-番禺区-大学城,https://www.zhipin.com/job_detail/8d3aebe3f5c32efa03Ry2d66EFNX.html,boss,0,您未提供简历内容，无法提取核心技能、工作年限及求职意向，因此无法评估与 PYTHON 开发工程师岗位的匹配度。,不推荐,由于缺少简历信息，无法判断候选人是否满足‘在校/应届，本科’的硬性要求，建议补充简历后重新评估。,您好，我是一名计算机专业应届生，对贵司 PYTHON 开发岗位非常感兴趣，期待能有机会进一步沟通。
Python 爬虫开发工程师,,全职，要求在校/应届，本科,牛媒数据,广州,工作地点：广州-海珠区-赤岗,https://www.zhipin.com/job_detail/59849531fcd14e6a1n152Nq7F1NV.html,boss,0,您未提供简历内容，无法评估技能与经验匹配度。岗位明确要求在校/应届本科生，需确认您的学历状态。,不推荐,由于缺少简历信息，无法判断您是否符合在校/应届生的硬性要求，建议补充完整简历后再评估。,您好，我对贵司Python爬虫开发岗位很感兴趣，是本科在读/应届生，熟悉Python基础及网络请求库，期待能补充简历后进一步沟通。
AI开发工程师（Python）,,全职，要求3-5年，本科,信雅达科技股份,广州,工作地点：广州-荔湾区-陈家祠,https://www.zhipin.com/job_detail/e8206f6ad329afc603dz3N-0GVtU.html,boss,0,未提供简历内容，无法评估技能、经验及薪资匹配度。,不推荐,缺少简历信息，无法进行有效匹配分析。,您好，我注意到贵司正在招聘AI开发工程师，但我尚未上传简历。希望能补充简历后，为您进一步评估匹配度。
Python 开发工程师,,全职，要求3-5年，本科,卓术科技,广州,工作地点：广州-天河区-林和,https://www.zhipin.com/job_detail/70bb47d881c5376803B-29i8EVVU.html,boss,0,您提供的简历内容为空，无法提取核心技能、工作年限及主要成就，因此无法进行有效的技能与经验匹配度评估。,不推荐,由于缺少简历信息，无法判断候选人是否符合岗位要求的3-5年经验及本科背景，建议补充完整简历后再进行评估。,您好，我注意到贵司正在招聘Python开发工程师，但我这边简历信息尚未完善，希望能补充完整后与您进一步沟通，谢谢！
AI应用开发工程师（Python）,,全职，要求5-10年，本科,旭普,广州,工作地点：广州-天河区-高唐,https://www.zhipin.com/job_detail/47e3c5d7559207e903Fy29q7E1tY.html,boss,0,您提供的简历内容为空，无法提取核心技能、工作年限及主要成就，因此无法进行有效的技能与经验匹配分析。,不推荐,由于缺少简历信息，无法判断您是否符合岗位要求的5-10年经验及本科背景，建议补充简历后重新评估。,您好，我对贵司AI应用开发岗位很感兴趣，但因简历信息缺失，无法展示我的Python及AI项目经验，期待补充后进一步沟通。
