title,salary,requirements,company,city,description,link,source,match_score,match_reason,recommendation,recommendation_reason,greeting
数据标注/AI训练师,30-200元/时,全职，要求经验不限，学历不限,智醒科技,广州,工作地点：广州-白云区-松洲,https://www.zhipin.com/job_detail/e7153b704e0f13bd1H1809m8EFtT.html,boss,70,候选人持有AI训练师证书且有计算机视觉与大模型项目经验，与岗位名称高度契合；但技能栈偏向全栈开发与算法落地，从事基础数据标注属于技能降级，且时薪制对技术人才吸引力有限。,可以考虑,岗位门槛低且与AI背景契合，适合积累行业经验，但长期看需向算法或开发岗转型。,您好，我持有AI训练师三级证书，有YOLO模型训练及大模型微调项目经验，熟悉数据全流程。希望能有机会加入贵司，从基础标注做起，发挥技术优势。
AIGC训练师（品牌视觉方向）,7-11K,全职，要求1-3年，本科,广州市秦哥哥餐饮公司,广州,工作地点：广州-海珠区-琶洲,https://www.zhipin.com/job_detail/cfc11f4434bca2a60nd72ti4FlNT.html,boss,70,候选人具备 Python 和 AI 相关技能（大模型部署、CV），与 AIGC 岗位有技术交集，但岗位侧重品牌视觉，候选人项目偏后端与通用 AI，且学历为大专，与岗位本科要求存在差距。,可以考虑,技术栈有重叠，但学历和项目方向不完全匹配，建议作为备选尝试投递。,您好，我有 AI 项目落地经验，熟悉大模型部署与计算机视觉，曾获人工智能大赛一等奖，对品牌视觉 AIGC 方向很感兴趣，期待沟通。
AI人像模型训练师,10-15K,全职，要求3-5年，本科,小桌投资,广州,工作地点：广州-天河区-珠江新城,https://www.zhipin.com/job_detail/1409f6bcb733b7ca1HF-09W7F1dV.html,boss,67,您的Python、计算机视觉及大模型微调技能与岗位高度匹配（85分），且有国赛一等奖加持；但岗位硬性要求3-5年经验及本科学历，您目前为应届生且学历为大专，经验相关性得分较低（30分）。,可以考虑,技能栈高度契合且具备竞赛获奖优势，但工作年限与学历未达硬性门槛，建议作为潜力候选人尝试投递或沟通实习转正机会。,您好，我对AI人像模型训练师岗位非常感兴趣。我有扎实的Python与CV基础，曾获全国人工智能应用技能大赛一等奖，熟悉大模型微调，希望能有机会与您沟通。
数据标注/AI训练师,2-3K,全职，要求在校/应届，学历不限,广州振轩智能科技,广州,工作地点：广州-黄埔区-大沙,https://www.zhipin.com/job_detail/b0f0f31a931287600nF63ti7FFJW.html,boss,65,候选人持有AI训练师证书且有丰富AI项目经验，技能高度匹配（85分），但岗位薪资2-3K远低于市场水平，薪资匹配度极低（20分）。,可以考虑,技能完全覆盖岗位需求，但薪资过低且岗位层级低于候选人能力，仅适合作为短期过渡或实习。,您好，我是蒋睿，持有AI训练师三级证书，有丰富的大模型和CV项目经验。虽然岗位薪资较低，但我对AI训练工作非常感兴趣，希望能有机会沟通。
低阶影视视频标注模型训练师,150-160元/天,全职，要求，大专,广州玉团网络科技,广州,工作地点：广州-黄埔区-大沙,https://www.zhipin.com/job_detail/f403bade5ea6ab640nB_0ti_GFJZ.html,boss,65,候选人具备AI相关项目经验（如人脸识别、模型训练），但岗位偏向基础标注与训练，技能存在一定溢出。学历符合大专要求，薪资处于入门级水平，与候选人未明确薪资期望基本兼容。,建议投递,虽然岗位层级较低，但候选人具备AI背景，可作为职业起步或过渡，且学历与全职要求完全匹配。,您好，我有AI项目实战经验，熟悉模型训练与数据处理，对影视视频标注工作有浓厚兴趣，希望能加入贵团队。
AI训练（葡萄牙语）,6-10K,全职，要求经验不限，本科,虎跃数据,广州,工作地点：广州-天河区-龙洞,https://www.zhipin.com/job_detail/a2719734371baec30nF62tq9F1RR.html,boss,65,候选人具备 Python 和 AI 项目经验，但岗位核心要求葡萄牙语能力未在简历中体现，且学历为大专（岗位要求本科），存在硬性门槛差距。,可以考虑,虽然候选人有 AI 相关项目经验，但缺乏葡萄牙语技能且学历不符，建议作为备选尝试，需确认语言要求是否可放宽。,您好，我对 AI 训练岗位很感兴趣。我有 Python 和计算机视觉项目经验，曾参与大模型部署，希望能进一步沟通岗位对语言能力的具体要求。
AI训练师广州/本科,7-8K,全职，要求1-3年，本科,南宁喆胤文化传媒,广州,工作地点：广州-天河区-天河北,https://www.zhipin.com/job_detail/ec92d8859445178e0nRz3N6-GVdR.html,boss,65,候选人具备大模型部署与微调、计算机视觉等核心技能，与AI训练师岗位高度匹配（85分），但学历为大专且缺乏1-3年全职工作经验，经验相关性较低（50分）。,可以考虑,技能点高度契合岗位需求，但学历和经验年限未完全达标，建议作为备选投递，重点突出项目实战能力。,您好，我对AI训练师岗位很感兴趣。我有大模型微调与计算机视觉项目经验，获过人工智能大赛一等奖，希望能有机会沟通。
数据标注/AI训练师,100-110元/天,全职，要求，大专,广州温平商贸有限公司,广州,工作地点：广州-天河区-元岗,https://www.zhipin.com/job_detail/bd2161d2b62e12610nB83Nm6EFBV.html,boss,65,候选人持有AI训练师证书且具备模型微调经验，技能完全覆盖岗位要求。但岗位薪资过低（100-110元/天），与候选人的开发能力严重不匹配，职业成长空间有限。,可以考虑,技能完全匹配且有证书加持，但薪资过低且岗位技术含量有限，仅适合作为短期过渡或实习。,您好，我持有AI训练师证书，具备模型微调与CV项目经验，能高效完成标注任务。请问该岗位是否有技术晋升路径？期待沟通。
数据标注/AI训练师,4-5K,全职，要求在校/应届，本科,广州市艺彩职业技...,广州,工作地点：广州-番禺区-市桥,https://www.zhipin.com/job_detail/159ac5fb2ca1427b0nd73d6-FldZ.html,boss,65,候选人具备Python、AI模型训练及计算机视觉等技能，与岗位技术栈高度匹配（80分），但岗位明确要求本科学历，候选人学历为大专，存在硬性门槛差异。,可以考虑,虽然技能匹配度高且有AI相关项目经验，但学历不符合岗位要求，且薪资偏低，发展空间有限，建议作为备选。,您好，我具备Python及AI模型训练经验，曾参与大模型部署与CV项目，对数据标注工作有浓厚兴趣，希望能有机会沟通。
数据标注/ai训练师——医学方向,8-13K,全职，要求1-3年，硕士,广州超云智康生命科技,广州,工作地点：广州-黄埔区-科学城,https://www.zhipin.com/job_detail/e6345212ad76e7fd0nd43969EFNZ.html,boss,60,候选人具备Python、AI模型微调及计算机视觉技能，与AI训练师岗位技术栈匹配度较高（80分）。但岗位明确要求硕士学历及1-3年全职经验，候选人学历为大专且项目多为校园/竞赛性质，经验相关性较低（40分）。薪资范围8-13K对应届生尚可，但学历门槛是主要短板。,可以考虑,虽然技能栈与AI训练方向有重合，但学历和经验年限与硬性要求存在差距，建议作为备选尝试投递，重点突出项目中的模型训练与数据处理能力。,您好，我对医学AI训练师岗位很感兴趣。我有Python及大模型微调经验，曾主导过人脸识别与巡检系统开发，具备扎实的数据处理与模型训练能力，期待能有机会进一步沟通。
AI训练师,24-30K,全职，要求1-3年，本科,无添加化妆品,广州,工作地点：广州--,https://www.zhipin.com/job_detail/9ecb56e2fc63e8f90nd40964EltT.html,boss,60,您的Python、大模型微调及计算机视觉技能与AI训练师岗位高度匹配（85分），项目经验也具备相关性（70分）。但岗位明确要求本科学历，您为大专学历，且薪资期望24-30K远超应届生/初级水平，薪资匹配度较低（30分）。,可以考虑,技能匹配度高，但学历和薪资期望存在较大差距，建议作为备选尝试投递，重点突出竞赛获奖和项目落地能力。,您好，我对AI训练师岗位非常感兴趣。我有大模型微调、CV项目落地经验及国赛一等奖，虽学历为大专，但技术实战能力强，期待能有机会沟通。
数据标注/AI训练师,100-200元/天,全职，要求，初中及以下,铠传科技,广州,工作地点：广州-增城区-永和,https://www.zhipin.com/job_detail/d14ea3c2ad48906a0nBy39q9FlBV.html,boss,55,候选人具备扎实的 AI 模型部署、微调及计算机视觉技能，远超岗位基础要求。但岗位薪资（100-200元/天）与候选人技术背景严重不匹配，且学历要求过低，存在人才错配风险。,不推荐,虽然技能高度匹配，但薪资过低且岗位定位基础，无法发挥候选人技术优势，建议寻找更具成长性的 AI 开发或算法工程师岗位。,您好，我有 AI 模型微调与 CV 项目落地经验，获过省级 AI 大赛一等奖。该岗位薪资与我的技术背景差距较大，不知是否有更匹配的开发岗机会？
AI训练工程师,10-15K·13薪,全职，要求3-5年，本科,云迹智能,广州,工作地点：广州-黄埔区-中心城,https://www.zhipin.com/job_detail/8b8e1946fda669780nZ60ty4FFpR.html,boss,55,您的 Python 和 AI 相关技能（大模型、CV）与岗位高度匹配（80分），但学历（大专）和工作经验（应届生/实习）与岗位硬性要求（本科、3-5年）存在较大差距（30分）。,可以考虑,技能栈对口且有竞赛获奖加持，但硬性门槛（学历/年限）不足，建议作为备选尝试投递，或先积累更多项目经验。,您好，我对AI训练工程师岗位很感兴趣。我有大模型部署、CV及Python开发经验，曾获人工智能大赛一等奖，期待能有机会沟通。
ai内容运营训练师（护肤品+大小周）,15-18K,全职，要求3-5年，本科,七品运营管理有限公司,广州,工作地点：广州-天河区-体育中心,https://www.zhipin.com/job_detail/e1e47d01a8cc089e0nF62tS0FFNY.html,boss,55,候选人持有AI训练师证书且熟悉大模型微调，技能与岗位名称匹配；但学历为大专且缺乏3-5年全职工作经验，硬性条件差距较大。,可以考虑,虽然具备AI相关技能证书，但学历和工作年限未达到岗位硬性要求，建议作为备选尝试投递。,您好，我持有AI训练师三级证书，熟悉大模型微调与部署，有计算机视觉及小程序落地经验，虽为应届生但技术扎实，期待能有机会面试沟通。
ai训练师,4-5K,全职，要求3-5年，学历不限,行也文化传媒有限公司,广州,工作地点：广州-白云区-嘉禾,https://www.zhipin.com/job_detail/53a44bd30dea62830nB70tq-GVtU.html,boss,55,候选人具备Python、大模型部署及计算机视觉等AI相关技能，与岗位方向契合。但岗位要求3-5年经验，候选人项目多为竞赛/校园性质，缺乏全职工作经验，经验匹配度较低。,可以考虑,技能基础扎实，但工作经验严重不足，建议作为备选或争取实习/初级岗位。,您好，我对AI训练师岗位很感兴趣。我有大模型部署、微调及CV项目经验，虽工作年限未达要求，但学习能力强，希望能有机会沟通。
小语种语音训练师,250-400元/天,全职，要求，本科,聪明狗AI,广州,工作地点：广州-越秀区-东风中路,https://www.zhipin.com/job_detail/eb5f06c2cec0d2100nF62dq6FVRZ.html,boss,55,候选人具备AI模型训练和计算机视觉经验，但岗位核心要求小语种语音处理，技能方向存在偏差。学历为大专，未达到岗位要求的本科硬性门槛。,不推荐,学历硬性要求不符，且专业技能与语音训练师岗位核心需求匹配度较低，建议寻找更匹配的开发类岗位。,您好，我对贵司AI训练师岗位感兴趣。我有大模型微调及计算机视觉项目经验，虽学历为大专，但技术落地能力强，希望能有机会沟通。
接受应届生（AI风口销售行业+无需外出！）,5-10K,全职，要求在校/应届，大专,广州希必网络技术,广州,工作地点：广州-天河区-棠下,https://www.zhipin.com/job_detail/f417e0f8a70db63f0nV92tm5GFFQ.html,boss,45,候选人技术背景深厚（AI、开发），但岗位为销售岗，技能与职责严重错位。虽然学历和应届生身份符合要求，但职业方向不匹配。,不推荐,候选人是技术型人才，岗位是销售岗，职业路径不匹配，建议寻找技术研发类岗位。,您好，我是人工智能专业应届生，有国赛一等奖及大模型落地经验。虽看到贵司销售岗，但更希望能探讨技术或AI应用类机会，期待沟通。
AI短视频训练编导,15-30K,全职，要求1-3年，本科,广州妈咪营养搭档...,广州,工作地点：广州-黄埔区-万达广场,https://www.zhipin.com/job_detail/4ebe399f5c65bb000nB83ti4ElNW.html,boss,42,候选人具备AI技术背景（大模型部署、CV），但岗位核心是短视频编导与内容策划，技术栈与职能方向存在偏差。学历为大专且缺乏1-3年相关编导经验，硬性条件匹配度较低。,不推荐,岗位明确要求本科及1-3年编导经验，候选人学历与经验均不达标，且技术背景与编导职能匹配度低，建议优先投递AI开发或算法相关岗位。,您好，我对AI短视频方向很感兴趣，具备大模型部署与计算机视觉项目经验，希望能有机会交流技术赋能内容创作的可能性。
AI标注员-小语种方向-（葡萄牙语/印尼语）,6-10K,全职，要求经验不限，本科,上海勤穆网络科技,广州,工作地点：广州-天河区-龙洞,https://www.zhipin.com/job_detail/9e2f0237de78db590nd839q4GVRW.html,boss,35,候选人具备 AI 开发背景，但岗位为 AI 标注，技能严重错配。学历为大专，岗位要求本科，存在硬性门槛。薪资范围符合预期，但职业发展方向与候选人求职意向（开发/AI工程师）不符。,不推荐,岗位为 AI 标注，与候选人开发/AI 工程师的求职意向严重不符，且学历未达本科要求，职业发展空间有限。,您好，我有 AI 开发与模型微调经验，虽对标注岗位感兴趣，但更希望从事开发类工作，不知是否有其他机会？
AI自动化测试平台训练师,15-25K,全职，要求5-10年，本科,赛博威,广州,工作地点：广州-黄埔区-东圃,https://www.zhipin.com/job_detail/a7f1727c3714a2b50nB82tu4ElFR.html,boss,30,候选人具备Python、AI模型部署及计算机视觉技能，与岗位技术栈有一定重合。但岗位要求5-10年经验且需本科学历，候选人仅有大专学历且为应届生/实习水平，经验严重不足。,不推荐,学历与工作年限要求差距过大，薪资期望（15-25K）远超候选人当前能力水平，建议先积累基础开发经验。,您好，我对AI自动化测试方向很感兴趣，具备Python及大模型微调基础，虽经验尚浅但学习力强，希望能争取初级岗位机会。
AI标注员-小语种方向-（葡萄牙语/印尼语）,6-10K,全职，要求经验不限，本科,华剑全全,广州,工作地点：广州-天河区-龙洞,https://www.zhipin.com/job_detail/e774623b280b17cd0nB82dS6EFBX.html,boss,27,岗位核心要求小语种（葡萄牙语/印尼语）能力，简历中完全未体现相关语言背景；候选人具备AI开发与CV技能，与基础标注工作严重错位。,不推荐,技能完全不匹配，且候选人具备AI开发能力，从事标注工作属于职业降级，建议寻找AI开发或算法相关岗位。,您好，我有AI开发与训练背景，熟悉大模型微调及CV技术。虽岗位为标注方向，但希望能探讨是否有更匹配的技术岗机会，期待沟通。
感统训练师-昌岗,7-12K,全职，要求经验不限，大专,金博智慧,广州,工作地点：广州-海珠区-江南大道,https://www.zhipin.com/job_detail/af19f0e3bac45dc80nZ839S-F1pQ.html,boss,21,您的技能栈主要集中在软件开发与人工智能领域（Python、Java、大模型等），与感统训练师岗位所需的康复/教育专业技能完全不匹配。过往项目经验均为技术类，缺乏感统训练相关背景。,不推荐,简历显示您为软件开发/AI方向人才，而岗位为感统训练师，属于完全不同的职业赛道，技能与经验均无相关性，建议寻找技术类岗位。,您好，我注意到贵司感统训练师岗位，但我主要背景是软件开发与AI技术，与岗位要求差异较大，恐难胜任，建议关注我司技术岗机会。
音乐训练师 居家办公,6-7K,全职，要求经验不限，本科,汉克时代,广州,工作地点：广州-白云区-江高,https://www.zhipin.com/job_detail/d5a1c6ea298ecc700nB-3ty1E1FR.html,boss,20,您的技术背景（Python/AI/开发）与音乐训练师岗位职能严重错位，技能匹配度极低。虽然薪资在可接受范围，但职业发展方向不匹配。,不推荐,您的简历显示为软件开发与人工智能方向，而岗位为音乐训练师，专业领域完全不匹配，建议投递技术类岗位。,您好，我注意到贵司音乐训练师岗位，但我更专注于AI与软件开发，拥有多项相关竞赛获奖及项目经验，不知是否有技术类岗位可沟通？
数据标注/ai训练师,10-15K,全职，要求在校/应届，本科,广东工创智造科技,广州,工作地点：广州-番禺区-大学城,https://www.zhipin.com/job_detail/e6716a76a7a5a3be0nV539q1EFBW.html,boss,0,"AI 评分失败: Error code: 400 - {'error': {'message': 'engine is not available temporarily', 'type': 'failed_precondition_error', 'code': '9'}}",不推荐,AI 分析失败，无法给出推荐,您好，我对贵公司的数据标注/ai训练师很感兴趣，希望能进一步沟通。
ai训练师,13-26K,全职，要求1-3年，本科,十月六,广州,工作地点：广州-白云区-黄边,https://www.zhipin.com/job_detail/3682a0c8a684b2370nV83di1ElNQ.html,boss,0,"AI 评分失败: Error code: 400 - {'error': {'message': 'engine is not available temporarily', 'type': 'failed_precondition_error', 'code': '9'}}",不推荐,AI 分析失败，无法给出推荐,您好，我对贵公司的ai训练师很感兴趣，希望能进一步沟通。
AI训练学徒,80-120元/天,全职，要求，学历不限,团剧,广州,工作地点：广州-天河区-东圃,https://www.zhipin.com/job_detail/c20860f63ae97233031839--GVBZ.html,boss,0,"AI 评分失败: Error code: 400 - {'error': {'message': 'engine is not available temporarily', 'type': 'failed_precondition_error', 'code': '9'}}",不推荐,AI 分析失败，无法给出推荐,您好，我对贵公司的AI训练学徒很感兴趣，希望能进一步沟通。
AI训练师实习生【实习4个月及以上】,80-130元/天,全职，要求，本科,励丰文化科技,广州,工作地点：广州-黄埔区-科学城,https://www.zhipin.com/job_detail/e72ab10c755fa0210nB43dq9F1RZ.html,boss,0,"AI 评分失败: Error code: 400 - {'error': {'message': 'engine is not available temporarily', 'type': 'failed_precondition_error', 'code': '9'}}",不推荐,AI 分析失败，无法给出推荐,您好，我对贵公司的AI训练师实习生【实习4个月及以上】很感兴趣，希望能进一步沟通。
AI 训练师 （五险一金双休包餐）,14-24K,全职，要求1-3年，本科,兴趣岛,广州,工作地点：广州-天河区-棠下,https://www.zhipin.com/job_detail/2be26027d6a6d1350nd42d-7GFpY.html,boss,0,"AI 评分失败: Error code: 429 - {'error': {'message': 'rpm exhausted', 'type': 'quota_exceeded_error', 'code': '8'}}",不推荐,AI 分析失败，无法给出推荐,您好，我对贵公司的AI 训练师 （五险一金双休包餐）很感兴趣，希望能进一步沟通。
ai应用训练师,5-10K·13薪,全职，要求1-3年，本科,深圳元镜视界科技,广州,工作地点：广州-花都区-花山,https://www.zhipin.com/job_detail/165df41c761bf1ae0nZ-29m0EFtY.html,boss,0,"AI 评分失败: Error code: 429 - {'error': {'message': 'rpm exhausted', 'type': 'quota_exceeded_error', 'code': '8'}}",不推荐,AI 分析失败，无法给出推荐,您好，我对贵公司的ai应用训练师很感兴趣，希望能进一步沟通。
AI训练师,6-8K,全职，要求1-3年，大专,星脉,广州,工作地点：广州-海珠区-凤阳,https://www.zhipin.com/job_detail/7f245e986b34de600nRy09u6E1VW.html,boss,0,"AI 评分失败: Error code: 429 - {'error': {'message': 'rpm exhausted', 'type': 'quota_exceeded_error', 'code': '8'}}",不推荐,AI 分析失败，无法给出推荐,您好，我对贵公司的AI训练师很感兴趣，希望能进一步沟通。
AI训练数据标注,100-150元/天,全职，要求，本科,微体科技,广州,工作地点：广州-黄埔区-中心城,https://www.zhipin.com/job_detail/0248936a7832c9920nB52ti1E1FU.html,boss,0,"AI 评分失败: Error code: 429 - {'error': {'message': 'rpm exhausted', 'type': 'quota_exceeded_error', 'code': '8'}}",不推荐,AI 分析失败，无法给出推荐,您好，我对贵公司的AI训练数据标注很感兴趣，希望能进一步沟通。
AI训练师,8-11K,全职，要求1-3年，本科,启年科技,广州,工作地点：广州-番禺区-南村,https://www.zhipin.com/job_detail/c116f77e44bc49b00nB52dW9F1VZ.html,boss,0,"AI 评分失败: Error code: 429 - {'error': {'message': 'rpm exhausted', 'type': 'quota_exceeded_error', 'code': '8'}}",不推荐,AI 分析失败，无法给出推荐,您好，我对贵公司的AI训练师很感兴趣，希望能进一步沟通。
电商AI训练师（探域/护肤）,12-20K,全职，要求3-5年，大专,尤黛,广州,工作地点：广州--,https://www.zhipin.com/job_detail/d194748e520334bb0nB829-4EFVW.html,boss,0,"AI 评分失败: Error code: 429 - {'error': {'message': 'rpm exhausted', 'type': 'quota_exceeded_error', 'code': '8'}}",不推荐,AI 分析失败，无法给出推荐,您好，我对贵公司的电商AI训练师（探域/护肤）很感兴趣，希望能进一步沟通。
ai训练师,10-15K,全职，要求1-3年，本科,香彩电商,广州,工作地点：广州-番禺区-大石,https://www.zhipin.com/job_detail/c08e91072b5f15c80nVz29W0ElZX.html,boss,0,"AI 评分失败: Error code: 429 - {'error': {'message': 'rpm exhausted', 'type': 'quota_exceeded_error', 'code': '8'}}",不推荐,AI 分析失败，无法给出推荐,您好，我对贵公司的ai训练师很感兴趣，希望能进一步沟通。
AI视觉训练师,25-40K·13薪,全职，要求3-5年，本科,SHEIN,广州,工作地点：广州-番禺区-市桥,https://www.zhipin.com/job_detail/8c42f6d4da02afc20nBz3du1EVZX.html,boss,0,"AI 评分失败: Error code: 429 - {'error': {'message': 'rpm exhausted', 'type': 'quota_exceeded_error', 'code': '8'}}",不推荐,AI 分析失败，无法给出推荐,您好，我对贵公司的AI视觉训练师很感兴趣，希望能进一步沟通。
AI训练师（大模型调优/多模态应用）,10-15K,全职，要求经验不限，学历不限,粤楷装饰,广州,工作地点：广州-白云区-嘉禾,https://www.zhipin.com/job_detail/20820e74c9b582600nV-2du8GVNY.html,boss,0,"AI 评分失败: Error code: 429 - {'error': {'message': 'rpm exhausted', 'type': 'quota_exceeded_error', 'code': '8'}}",不推荐,AI 分析失败，无法给出推荐,您好，我对贵公司的AI训练师（大模型调优/多模态应用）很感兴趣，希望能进一步沟通。
AI训练师（实习生）,100-200元/天,全职，要求，本科,好娃玩偶定制,广州,工作地点：广州-番禺区-大学城,https://www.zhipin.com/job_detail/7d682db4b7f9d2641HJ-3dW1EVpX.html,boss,0,"AI 评分失败: Error code: 429 - {'error': {'message': 'rpm exhausted', 'type': 'quota_exceeded_error', 'code': '8'}}",不推荐,AI 分析失败，无法给出推荐,您好，我对贵公司的AI训练师（实习生）很感兴趣，希望能进一步沟通。
ai训练师,4-7K,全职，要求经验不限，硕士,米袋传媒,广州,工作地点：广州-增城区-荔城,https://www.zhipin.com/job_detail/892d4ecfd64873360nZz2Ni5FVdX.html,boss,0,"AI 评分失败: Error code: 429 - {'error': {'message': 'rpm exhausted', 'type': 'quota_exceeded_error', 'code': '8'}}",不推荐,AI 分析失败，无法给出推荐,您好，我对贵公司的ai训练师很感兴趣，希望能进一步沟通。
数据标注/AI训练师,15-25K,全职，要求3-5年，本科,高勘,广州,工作地点：广州--,https://www.zhipin.com/job_detail/81b62718554fbd520ndy39i7FVRW.html,boss,0,"AI 评分失败: Error code: 429 - {'error': {'message': 'rpm exhausted', 'type': 'quota_exceeded_error', 'code': '8'}}",不推荐,AI 分析失败，无法给出推荐,您好，我对贵公司的数据标注/AI训练师很感兴趣，希望能进一步沟通。
ai应用工程师,10-15K,全职，要求1-3年，本科,翰代维,广州,工作地点：广州-番禺区-南村,https://www.zhipin.com/job_detail/4da9309f76d127fd0nRz0t68FFVQ.html,boss,0,"AI 评分失败: Error code: 429 - {'error': {'message': 'rpm exhausted', 'type': 'quota_exceeded_error', 'code': '8'}}",不推荐,AI 分析失败，无法给出推荐,您好，我对贵公司的ai应用工程师很感兴趣，希望能进一步沟通。
